DROP DATABASE IF EXISTS inc_sequoiadb;
CREATE DATABASE inc_sequoiadb;
USE inc_sequoiadb;
CREATE TABLE t1(a TINYINT, b TINYINT UNSIGNED);
CREATE INDEX a ON t1(b);
INSERT INTO t1 VALUES(127, 255);
UPDATE t1 SET a = a-255;
SELECT * FROM t1;
a	b
-128	255
UPDATE t1 SET b = b-255;
SELECT * FROM t1;
a	b
-128	0
UPDATE t1 SET a = a+255;
SELECT * FROM t1;
a	b
127	0
UPDATE t1 SET b = b+255;
SELECT * FROM t1;
a	b
127	255
UPDATE t1 SET a = a-255;
SELECT * FROM t1;
a	b
-128	255
UPDATE t1 SET b = b-255;
SELECT * FROM t1;
a	b
-128	0
UPDATE t1 SET a = 255+a;
SELECT * FROM t1;
a	b
127	0
UPDATE t1 SET b = 255+b;
SELECT * FROM t1;
a	b
127	255
UPDATE t1 SET a = a-128;
SELECT * FROM t1;
a	b
-1	255
UPDATE t1 SET b = b-128;
SELECT * FROM t1;
a	b
-1	127
UPDATE t1 SET a = a-127;
SELECT * FROM t1;
a	b
-128	127
UPDATE t1 SET b = b-127;
SELECT * FROM t1;
a	b
-128	0
UPDATE t1 SET a = a-1;
ERROR 22003: Out of range value for column 'a' at row 1
UPDATE t1 SET b = b-1;
ERROR 22003: BIGINT UNSIGNED value is out of range in '(`inc_sequoiadb`.`t1`.`b` - 1)'
UPDATE t1 SET a = a+256;
ERROR 22003: Out of range value for column 'a' at row 1
UPDATE t1 SET a = 256+a;
ERROR 22003: Out of range value for column 'a' at row 1
UPDATE t1 SET b = b+256;
ERROR 22003: Out of range value for column 'b' at row 1
UPDATE t1 SET b = 256+b;
ERROR 22003: Out of range value for column 'b' at row 1
SELECT * FROM t1;
a	b
-128	0
DELETE FROM t1;
INSERT INTO t1 VALUES();
UPDATE t1 SET a = a + 1;
SELECT * FROM t1;
a	b
NULL	NULL
UPDATE t1 SET a = a - 1;
SELECT * FROM t1;
a	b
NULL	NULL
UPDATE t1 SET b = b + 1;
SELECT * FROM t1;
a	b
NULL	NULL
UPDATE t1 SET b = b - 1;
SELECT * FROM t1;
a	b
NULL	NULL
UPDATE t1 SET a = 1;
UPDATE t1 SET b = 1;
SELECT * FROM t1;
a	b
1	1
UPDATE t1 SET a = 127;
UPDATE t1 SET b = 255;
SELECT * FROM t1;
a	b
127	255
UPDATE t1 SET a = -128;
UPDATE t1 SET b = 0;
SELECT * FROM t1;
a	b
-128	0
UPDATE t1 SET a = -129;
ERROR 22003: Out of range value for column 'a' at row 1
UPDATE t1 SET b = -1;
ERROR 22003: Out of range value for column 'b' at row 1
UPDATE t1 SET a = 128;
ERROR 22003: Out of range value for column 'a' at row 1
UPDATE t1 SET b = 256;
ERROR 22003: Out of range value for column 'b' at row 1
SELECT * FROM t1;
a	b
-128	0
DROP TABLE t1;
CREATE TABLE t1(a SMALLINT, b SMALLINT UNSIGNED);
CREATE INDEX a ON t1(a);
INSERT INTO t1 VALUES(32767, 65535);
UPDATE t1 SET a = a-65535;
SELECT * FROM t1;
a	b
-32768	65535
UPDATE t1 SET b = b-65535;
SELECT * FROM t1;
a	b
-32768	0
UPDATE t1 SET a = a+65535;
SELECT * FROM t1;
a	b
32767	0
UPDATE t1 SET b = b+65535;
SELECT * FROM t1;
a	b
32767	65535
UPDATE t1 SET a = a-65535;
SELECT * FROM t1;
a	b
-32768	65535
UPDATE t1 SET b = b-65535;
SELECT * FROM t1;
a	b
-32768	0
UPDATE t1 SET a = 65535+a;
SELECT * FROM t1;
a	b
32767	0
UPDATE t1 SET b = 65535+b;
SELECT * FROM t1;
a	b
32767	65535
UPDATE t1 SET a = a-32767;
SELECT * FROM t1;
a	b
0	65535
UPDATE t1 SET b = b-32767;
SELECT * FROM t1;
a	b
0	32768
UPDATE t1 SET a = a-32767;
SELECT * FROM t1;
a	b
-32767	32768
UPDATE t1 SET b = b-32767;
SELECT * FROM t1;
a	b
-32767	1
UPDATE t1 SET a = a-2;
ERROR 22003: Out of range value for column 'a' at row 1
UPDATE t1 SET b = b-2;
ERROR 22003: BIGINT UNSIGNED value is out of range in '(`inc_sequoiadb`.`t1`.`b` - 2)'
UPDATE t1 SET a = a+65536;
ERROR 22003: Out of range value for column 'a' at row 1
UPDATE t1 SET b = b+65535;
ERROR 22003: Out of range value for column 'b' at row 1
UPDATE t1 SET a = 65536+a;
ERROR 22003: Out of range value for column 'a' at row 1
UPDATE t1 SET b = 65535+b;
ERROR 22003: Out of range value for column 'b' at row 1
SELECT * FROM t1;
a	b
-32767	1
DELETE FROM t1;
INSERT INTO t1 VALUES();
UPDATE t1 SET a = a + 1;
SELECT * FROM t1;
a	b
NULL	NULL
UPDATE t1 SET a = a - 1;
SELECT * FROM t1;
a	b
NULL	NULL
UPDATE t1 SET b = b + 1;
SELECT * FROM t1;
a	b
NULL	NULL
UPDATE t1 SET b = b - 1;
SELECT * FROM t1;
a	b
NULL	NULL
UPDATE t1 SET a = 1;
UPDATE t1 SET b = 1;
SELECT * FROM t1;
a	b
1	1
UPDATE t1 SET a = 1;
UPDATE t1 SET b = 1;
SELECT * FROM t1;
a	b
1	1
UPDATE t1 SET a = 32767;
UPDATE t1 SET b = 65535;
SELECT * FROM t1;
a	b
32767	65535
UPDATE t1 SET a = -32768;
UPDATE t1 SET b = 0;
SELECT * FROM t1;
a	b
-32768	0
UPDATE t1 SET a = -32769;
ERROR 22003: Out of range value for column 'a' at row 1
UPDATE t1 SET b = -1;
ERROR 22003: Out of range value for column 'b' at row 1
UPDATE t1 SET a = 32768;
ERROR 22003: Out of range value for column 'a' at row 1
UPDATE t1 SET b = 65536;
ERROR 22003: Out of range value for column 'b' at row 1
SELECT * FROM t1;
a	b
-32768	0
DROP TABLE t1;
CREATE TABLE t1(a MEDIUMINT, b MEDIUMINT UNSIGNED);
CREATE INDEX a ON t1(a);
INSERT INTO t1 VALUES(8388607, 16777215);
UPDATE t1 SET a = a-16777215;
SELECT * FROM t1;
a	b
-8388608	16777215
UPDATE t1 SET b = b-16777215;
SELECT * FROM t1;
a	b
-8388608	0
UPDATE t1 SET a = a+16777215;
SELECT * FROM t1;
a	b
8388607	0
UPDATE t1 SET b = b+16777215;
SELECT * FROM t1;
a	b
8388607	16777215
UPDATE t1 SET a = a-16777215;
SELECT * FROM t1;
a	b
-8388608	16777215
UPDATE t1 SET b = b-16777215;
SELECT * FROM t1;
a	b
-8388608	0
UPDATE t1 SET a = 16777215+a;
SELECT * FROM t1;
a	b
8388607	0
UPDATE t1 SET b = 16777215+b;
SELECT * FROM t1;
a	b
8388607	16777215
UPDATE t1 SET a = a-8388607;
SELECT * FROM t1;
a	b
0	16777215
UPDATE t1 SET b = b-8388607;
SELECT * FROM t1;
a	b
0	8388608
UPDATE t1 SET a = a+8388607;
SELECT * FROM t1;
a	b
8388607	8388608
UPDATE t1 SET b = b+8388607;
SELECT * FROM t1;
a	b
8388607	16777215
UPDATE t1 SET a = a-16777216;
ERROR 22003: Out of range value for column 'a' at row 1
UPDATE t1 SET b = b-16777216;
ERROR 22003: BIGINT UNSIGNED value is out of range in '(`inc_sequoiadb`.`t1`.`b` - 16777216)'
UPDATE t1 SET a = a+1;
ERROR 22003: Out of range value for column 'a' at row 1
UPDATE t1 SET b = b+1;
ERROR 22003: Out of range value for column 'b' at row 1
UPDATE t1 SET a = 1+a;
ERROR 22003: Out of range value for column 'a' at row 1
UPDATE t1 SET b = 1+b;
ERROR 22003: Out of range value for column 'b' at row 1
SELECT * FROM t1;
a	b
8388607	16777215
DELETE FROM t1;
INSERT INTO t1 VALUES();
UPDATE t1 SET a = a + 1;
SELECT * FROM t1;
a	b
NULL	NULL
UPDATE t1 SET a = a - 1;
SELECT * FROM t1;
a	b
NULL	NULL
UPDATE t1 SET b = b + 1;
SELECT * FROM t1;
a	b
NULL	NULL
UPDATE t1 SET b = b - 1;
SELECT * FROM t1;
a	b
NULL	NULL
UPDATE t1 SET a = 1;
UPDATE t1 SET b = 1;
SELECT * FROM t1;
a	b
1	1
UPDATE t1 SET a = 8388607;
UPDATE t1 SET b = 16777215;
SELECT * FROM t1;
a	b
8388607	16777215
UPDATE t1 SET a = -8388608;
UPDATE t1 SET b = 0;
SELECT * FROM t1;
a	b
-8388608	0
UPDATE t1 SET a = -8388609;
ERROR 22003: Out of range value for column 'a' at row 1
UPDATE t1 SET b = -1;
ERROR 22003: Out of range value for column 'b' at row 1
UPDATE t1 SET a = 8388608;
ERROR 22003: Out of range value for column 'a' at row 1
UPDATE t1 SET b = 16777216;
ERROR 22003: Out of range value for column 'b' at row 1
SELECT * FROM t1;
a	b
-8388608	0
DROP TABLE t1;
CREATE TABLE t1(a INT, b INT UNSIGNED);
CREATE INDEX a ON t1(a);
INSERT INTO t1 VALUES(2147483647, 4294967295);
UPDATE t1 SET a = a-4294967295;
SELECT * FROM t1;
a	b
-2147483648	4294967295
UPDATE t1 SET b = b-4294967295;
SELECT * FROM t1;
a	b
-2147483648	0
UPDATE t1 SET a = a+4294967295;
SELECT * FROM t1;
a	b
2147483647	0
UPDATE t1 SET b = b+4294967295;
SELECT * FROM t1;
a	b
2147483647	4294967295
UPDATE t1 SET a = a-4294967295;
SELECT * FROM t1;
a	b
-2147483648	4294967295
UPDATE t1 SET b = b-4294967295;
SELECT * FROM t1;
a	b
-2147483648	0
UPDATE t1 SET a = 4294967295+a;
SELECT * FROM t1;
a	b
2147483647	0
UPDATE t1 SET b = 4294967295+b;
SELECT * FROM t1;
a	b
2147483647	4294967295
UPDATE t1 SET a = a-2147483647;
SELECT * FROM t1;
a	b
0	4294967295
UPDATE t1 SET b = b-2147483647;
SELECT * FROM t1;
a	b
0	2147483648
UPDATE t1 SET a = a+2147483647;
SELECT * FROM t1;
a	b
2147483647	2147483648
UPDATE t1 SET b = b+2147483647;
SELECT * FROM t1;
a	b
2147483647	4294967295
UPDATE t1 SET a = a-4294967296;
ERROR 22003: Out of range value for column 'a' at row 1
UPDATE t1 SET b = b-4294967296;
ERROR 22003: BIGINT UNSIGNED value is out of range in '(`inc_sequoiadb`.`t1`.`b` - 4294967296)'
UPDATE t1 SET a = a+1;
ERROR 22003: Out of range value for column 'a' at row 1
UPDATE t1 SET b = b+1;
ERROR 22003: Out of range value for column 'b' at row 1
UPDATE t1 SET a = 1+a;
ERROR 22003: Out of range value for column 'a' at row 1
UPDATE t1 SET b = 1+b;
ERROR 22003: Out of range value for column 'b' at row 1
SELECT * FROM t1;
a	b
2147483647	4294967295
DELETE FROM t1;
INSERT INTO t1 VALUES();
UPDATE t1 SET a = a + 1;
SELECT * FROM t1;
a	b
NULL	NULL
UPDATE t1 SET a = a - 1;
SELECT * FROM t1;
a	b
NULL	NULL
UPDATE t1 SET b = b + 1;
SELECT * FROM t1;
a	b
NULL	NULL
UPDATE t1 SET b = b - 1;
SELECT * FROM t1;
a	b
NULL	NULL
UPDATE t1 SET a = 1;
UPDATE t1 SET b = 1;
SELECT * FROM t1;
a	b
1	1
UPDATE t1 SET a = 2147483647;
UPDATE t1 SET b = 4294967295;
SELECT * FROM t1;
a	b
2147483647	4294967295
UPDATE t1 SET a = -2147483648;
UPDATE t1 SET b = 0;
SELECT * FROM t1;
a	b
-2147483648	0
UPDATE t1 SET a = -2147483649;
ERROR 22003: Out of range value for column 'a' at row 1
UPDATE t1 SET b = -1;
ERROR 22003: Out of range value for column 'b' at row 1
UPDATE t1 SET a = 2147483648;
ERROR 22003: Out of range value for column 'a' at row 1
UPDATE t1 SET b = 4294967296;
ERROR 22003: Out of range value for column 'b' at row 1
DROP TABLE t1;
CREATE TABLE t1(a BIGINT, b BIGINT UNSIGNED);
CREATE INDEX a ON t1(a);
INSERT INTO t1 VALUES(9223372036854775807, 18446744073709551615);
UPDATE t1 SET a = a-9223372036854775808;
ERROR 22003: BIGINT UNSIGNED value is out of range in '(`inc_sequoiadb`.`t1`.`a` - 9223372036854775808)'
UPDATE t1 SET a = a-9223372036854775807;
SELECT * FROM t1;
a	b
0	18446744073709551615
UPDATE t1 SET a = a-9223372036854775807;
SELECT * FROM t1;
a	b
-9223372036854775807	18446744073709551615
UPDATE t1 SET a = a-1;
SELECT * FROM t1;
a	b
-9223372036854775808	18446744073709551615
UPDATE t1 SET a = a-1;
ERROR 22003: BIGINT value is out of range in '(`inc_sequoiadb`.`t1`.`a` - 1)'
UPDATE t1 SET a = a+18446744073709551616;
ERROR 22003: Out of range value for column 'a' at row 1
UPDATE t1 SET a = a+18446744073709551615;
UPDATE t1 SET a = a-9223372036854775807;
UPDATE t1 SET a = a-9223372036854775807;
UPDATE t1 SET a = a-1;
UPDATE t1 SET a = 18446744073709551615+a;
SELECT * FROM t1;
a	b
9223372036854775807	18446744073709551615
UPDATE t1 SET a = a+1;
ERROR 22003: BIGINT value is out of range in '(`inc_sequoiadb`.`t1`.`a` + 1)'
UPDATE t1 SET a = 1+a;
ERROR 22003: BIGINT value is out of range in '(1 + `inc_sequoiadb`.`t1`.`a`)'
UPDATE t1 SET b = b-18446744073709551616;
ERROR 22003: Out of range value for column 'b' at row 1
UPDATE t1 SET b = b-18446744073709551615;
SELECT * FROM t1;
a	b
9223372036854775807	0
UPDATE t1 SET b = b+18446744073709551616;
ERROR 22003: Out of range value for column 'b' at row 1
UPDATE t1 SET b = b+18446744073709551615;
UPDATE t1 SET b = b-18446744073709551615;
UPDATE t1 SET b = 18446744073709551615+b;
SELECT * FROM t1;
a	b
9223372036854775807	18446744073709551615
UPDATE t1 SET b = b+1;
ERROR 22003: BIGINT UNSIGNED value is out of range in '(`inc_sequoiadb`.`t1`.`b` + 1)'
UPDATE t1 SET b = 1+b;
ERROR 22003: BIGINT UNSIGNED value is out of range in '(1 + `inc_sequoiadb`.`t1`.`b`)'
DELETE FROM t1;
INSERT INTO t1 VALUES();
UPDATE t1 SET a = a + 1;
SELECT * FROM t1;
a	b
NULL	NULL
UPDATE t1 SET a = a - 1;
SELECT * FROM t1;
a	b
NULL	NULL
UPDATE t1 SET b = b + 1;
SELECT * FROM t1;
a	b
NULL	NULL
UPDATE t1 SET b = b - 1;
SELECT * FROM t1;
a	b
NULL	NULL
UPDATE t1 SET a = 1;
UPDATE t1 SET b = 1;
SELECT * FROM t1;
a	b
1	1
UPDATE t1 SET a = 9223372036854775807;
UPDATE t1 SET b = 18446744073709551615;
SELECT * FROM t1;
a	b
9223372036854775807	18446744073709551615
UPDATE t1 SET a = -9223372036854775808;
UPDATE t1 SET b = 0;
SELECT * FROM t1;
a	b
-9223372036854775808	0
UPDATE t1 SET a = -9223372036854775809;
ERROR 22003: Out of range value for column 'a' at row 1
UPDATE t1 SET b = -1;
ERROR 22003: Out of range value for column 'b' at row 1
UPDATE t1 SET a = 9223372036854775808;
ERROR 22003: Out of range value for column 'a' at row 1
UPDATE t1 SET b = 18446744073709551616;
ERROR 22003: Out of range value for column 'b' at row 1
SELECT * FROM t1;
a	b
-9223372036854775808	0
DROP TABLE t1;
create table t1 ( id float primary key, f1 float, f2 float(16,2), f3 float unsigned, f4 float(16,2) unsigned );
insert into t1 values (-3.402823466E+38, -3.402823466E+38, -34028234669999.99, 0.01, 0.01);
insert into t1 values (0.1111111, 0.1111111, 0.11, 0.1111111, 0.11);
insert into t1 values (1234.56789, 1234.56789, 1234.56, 1234.56789, 1234.56);
insert into t1 values (-1.175494351E-38, -1.175494351E-38, -11754943599999.11, 1.794351E-38, 175494351.11);
insert into t1 values (1.175494351E-38, 1.175494351E-38, 11754943599999.11, 1.175494351E-38, 1175494351.11);
insert into t1 values (3.402823466351E+38, 3.402823466351E+38, 3402823466351, 3.402823466E+38, 3402823466351);
insert into t1 values (68940E+30, 68940E+30, 4823348320.2, 68940E+30, 4823348320.2);
insert into t1 values (0, 0, 0, 0, 0);
insert into t1 values (1, 0, 0, 1, 1);
insert into t1 values (123.456E+15, 123.456E+15, NULL, 123.456E+15, NULL);
insert into t1 values (-123456E-15, -123456E-15, -12345678998765.55, 123456E-15, 12345678998765.55);
update t1 set id = id - 1000E+20 where id < -0.1;
ERROR 22003: Out of range value for column 'id' at row 1
update t1 set f2 = f2 + 111111111111111 where id < 1;
ERROR 22003: Out of range value for column 'f2' at row 4
update t1 set f3 = f3 + 11e38 where id > 3.4e38;
ERROR 22003: Out of range value for column 'f3' at row 1
update t1 set f4 = f4 - 11e38 where id < 0;
ERROR 22003: Out of range value for column 'f4' at row 1
update t1 set f1 = f1 - 3.40282e38 where id = 0;
update t1 set f1 = f1 + 3.40282e38 where id = 1;
select * from t1 order by id;
id	f1	f2	f3	f4
-3.40282e38	-3.40282e38	-34028235259904.00	0.01	0.01
-0.000000000123456	-0.000000000123456	-12345679020032.00	0.000000000123456	12345679020032.00
-1.17549e-38	-1.17549e-38	-11754943807488.00	1.79435e-38	175494352.00
0	-3.40282e38	0.00	0	0.00
1.17549e-38	1.17549e-38	11754943807488.00	1.17549e-38	1175494400.00
0.111111	0.111111	0.11	0.111111	0.11
1	3.40282e38	0.00	1	1.00
1234.57	1234.57	1234.56	1234.57	1234.56
1.23456e17	1.23456e17	NULL	1.23456e17	NULL
6.894e34	6.894e34	4823348224.00	6.894e34	4823348224.00
3.40282e38	3.40282e38	3402823368704.00	3.40282e38	3402823368704.00
update t1 set f1 = f1 + 6.40282e38 where id = 0;
update t1 set f1 = f1 - 6.40282e38 where id = 1;
select * from t1 order by id;
id	f1	f2	f3	f4
-3.40282e38	-3.40282e38	-34028235259904.00	0.01	0.01
-0.000000000123456	-0.000000000123456	-12345679020032.00	0.000000000123456	12345679020032.00
-1.17549e-38	-1.17549e-38	-11754943807488.00	1.79435e-38	175494352.00
0	3e38	0.00	0	0.00
1.17549e-38	1.17549e-38	11754943807488.00	1.17549e-38	1175494400.00
0.111111	0.111111	0.11	0.111111	0.11
1	-3e38	0.00	1	1.00
1234.57	1234.57	1234.56	1234.57	1234.56
1.23456e17	1.23456e17	NULL	1.23456e17	NULL
6.894e34	6.894e34	4823348224.00	6.894e34	4823348224.00
3.40282e38	3.40282e38	3402823368704.00	3.40282e38	3402823368704.00
update t1 set f1 = f1 - 38E+10 where id > 0;
update t1 set f1 = f1 + 107E+10 where id < 0;
select * from t1 order by id;
id	f1	f2	f3	f4
-3.40282e38	-3.40282e38	-34028235259904.00	0.01	0.01
-0.000000000123456	1070000000000	-12345679020032.00	0.000000000123456	12345679020032.00
-1.17549e-38	1070000000000	-11754943807488.00	1.79435e-38	175494352.00
0	3e38	0.00	0	0.00
1.17549e-38	-380000000000	11754943807488.00	1.17549e-38	1175494400.00
0.111111	-380000000000	0.11	0.111111	0.11
1	-3e38	0.00	1	1.00
1234.57	-380000000000	1234.56	1234.57	1234.56
1.23456e17	1.23456e17	NULL	1.23456e17	NULL
6.894e34	6.894e34	4823348224.00	6.894e34	4823348224.00
3.40282e38	3.40282e38	3402823368704.00	3.40282e38	3402823368704.00
update t1 set f2 = f2 - 0.11 where f1 < 0;
select * from t1 order by id;
id	f1	f2	f3	f4
-3.40282e38	-3.40282e38	-34028235259904.00	0.01	0.01
-0.000000000123456	1070000000000	-12345679020032.00	0.000000000123456	12345679020032.00
-1.17549e-38	1070000000000	-11754943807488.00	1.79435e-38	175494352.00
0	3e38	0.00	0	0.00
1.17549e-38	-380000000000	11754943807488.00	1.17549e-38	1175494400.00
0.111111	-380000000000	0.00	0.111111	0.11
1	-3e38	-0.11	1	1.00
1234.57	-380000000000	1234.45	1234.57	1234.56
1.23456e17	1.23456e17	NULL	1.23456e17	NULL
6.894e34	6.894e34	4823348224.00	6.894e34	4823348224.00
3.40282e38	3.40282e38	3402823368704.00	3.40282e38	3402823368704.00
update t1 set f2 = f2 + 1111111111111 where id > 0;
select * from t1 order by id;
id	f1	f2	f3	f4
-3.40282e38	-3.40282e38	-34028235259904.00	0.01	0.01
-0.000000000123456	1070000000000	-12345679020032.00	0.000000000123456	12345679020032.00
-1.17549e-38	1070000000000	-11754943807488.00	1.79435e-38	175494352.00
0	3e38	0.00	0	0.00
1.17549e-38	-380000000000	12866054782976.00	1.17549e-38	1175494400.00
0.111111	-380000000000	1111111106560.00	0.111111	0.11
1	-3e38	1111111106560.00	1	1.00
1234.57	-380000000000	1111111106560.00	1234.57	1234.56
1.23456e17	1.23456e17	NULL	1.23456e17	NULL
6.894e34	6.894e34	1115934425088.00	6.894e34	4823348224.00
3.40282e38	3.40282e38	4513934606336.00	3.40282e38	3402823368704.00
update t1 set f3 = f3 - 1 where id = 1;
select * from t1 order by id;
id	f1	f2	f3	f4
-3.40282e38	-3.40282e38	-34028235259904.00	0.01	0.01
-0.000000000123456	1070000000000	-12345679020032.00	0.000000000123456	12345679020032.00
-1.17549e-38	1070000000000	-11754943807488.00	1.79435e-38	175494352.00
0	3e38	0.00	0	0.00
1.17549e-38	-380000000000	12866054782976.00	1.17549e-38	1175494400.00
0.111111	-380000000000	1111111106560.00	0.111111	0.11
1	-3e38	1111111106560.00	0	1.00
1234.57	-380000000000	1111111106560.00	1234.57	1234.56
1.23456e17	1.23456e17	NULL	1.23456e17	NULL
6.894e34	6.894e34	1115934425088.00	6.894e34	4823348224.00
3.40282e38	3.40282e38	4513934606336.00	3.40282e38	3402823368704.00
update t1 set f3 = f3 + 3e38 where id > 0 and id < 0.1;
select * from t1 order by id;
id	f1	f2	f3	f4
-3.40282e38	-3.40282e38	-34028235259904.00	0.01	0.01
-0.000000000123456	1070000000000	-12345679020032.00	0.000000000123456	12345679020032.00
-1.17549e-38	1070000000000	-11754943807488.00	1.79435e-38	175494352.00
0	3e38	0.00	0	0.00
1.17549e-38	-380000000000	12866054782976.00	3e38	1175494400.00
0.111111	-380000000000	1111111106560.00	0.111111	0.11
1	-3e38	1111111106560.00	0	1.00
1234.57	-380000000000	1111111106560.00	1234.57	1234.56
1.23456e17	1.23456e17	NULL	1.23456e17	NULL
6.894e34	6.894e34	1115934425088.00	6.894e34	4823348224.00
3.40282e38	3.40282e38	4513934606336.00	3.40282e38	3402823368704.00
update t1 set f4 = f4 - 1.00 where id = 1;
select * from t1 order by id;
id	f1	f2	f3	f4
-3.40282e38	-3.40282e38	-34028235259904.00	0.01	0.01
-0.000000000123456	1070000000000	-12345679020032.00	0.000000000123456	12345679020032.00
-1.17549e-38	1070000000000	-11754943807488.00	1.79435e-38	175494352.00
0	3e38	0.00	0	0.00
1.17549e-38	-380000000000	12866054782976.00	3e38	1175494400.00
0.111111	-380000000000	1111111106560.00	0.111111	0.11
1	-3e38	1111111106560.00	0	0.00
1234.57	-380000000000	1111111106560.00	1234.57	1234.56
1.23456e17	1.23456e17	NULL	1.23456e17	NULL
6.894e34	6.894e34	1115934425088.00	6.894e34	4823348224.00
3.40282e38	3.40282e38	4513934606336.00	3.40282e38	3402823368704.00
update t1 set f4 = f4 + 1.79435e-38 where id = 1;
select * from t1 order by id;
id	f1	f2	f3	f4
-3.40282e38	-3.40282e38	-34028235259904.00	0.01	0.01
-0.000000000123456	1070000000000	-12345679020032.00	0.000000000123456	12345679020032.00
-1.17549e-38	1070000000000	-11754943807488.00	1.79435e-38	175494352.00
0	3e38	0.00	0	0.00
1.17549e-38	-380000000000	12866054782976.00	3e38	1175494400.00
0.111111	-380000000000	1111111106560.00	0.111111	0.11
1	-3e38	1111111106560.00	0	0.00
1234.57	-380000000000	1111111106560.00	1234.57	1234.56
1.23456e17	1.23456e17	NULL	1.23456e17	NULL
6.894e34	6.894e34	1115934425088.00	6.894e34	4823348224.00
3.40282e38	3.40282e38	4513934606336.00	3.40282e38	3402823368704.00
update t1 set id = 175E+20 where id = 0;
select * from t1 order by id;
id	f1	f2	f3	f4
-3.40282e38	-3.40282e38	-34028235259904.00	0.01	0.01
-0.000000000123456	1070000000000	-12345679020032.00	0.000000000123456	12345679020032.00
-1.17549e-38	1070000000000	-11754943807488.00	1.79435e-38	175494352.00
1.17549e-38	-380000000000	12866054782976.00	3e38	1175494400.00
0.111111	-380000000000	1111111106560.00	0.111111	0.11
1	-3e38	1111111106560.00	0	0.00
1234.57	-380000000000	1111111106560.00	1234.57	1234.56
1.23456e17	1.23456e17	NULL	1.23456e17	NULL
1.75e22	3e38	0.00	0	0.00
6.894e34	6.894e34	1115934425088.00	6.894e34	4823348224.00
3.40282e38	3.40282e38	4513934606336.00	3.40282e38	3402823368704.00
update t1 set id = -175E+20 where id = 1;
select * from t1 order by id;
id	f1	f2	f3	f4
-3.40282e38	-3.40282e38	-34028235259904.00	0.01	0.01
-1.75e22	-3e38	1111111106560.00	0	0.00
-0.000000000123456	1070000000000	-12345679020032.00	0.000000000123456	12345679020032.00
-1.17549e-38	1070000000000	-11754943807488.00	1.79435e-38	175494352.00
1.17549e-38	-380000000000	12866054782976.00	3e38	1175494400.00
0.111111	-380000000000	1111111106560.00	0.111111	0.11
1234.57	-380000000000	1111111106560.00	1234.57	1234.56
1.23456e17	1.23456e17	NULL	1.23456e17	NULL
1.75e22	3e38	0.00	0	0.00
6.894e34	6.894e34	1115934425088.00	6.894e34	4823348224.00
3.40282e38	3.40282e38	4513934606336.00	3.40282e38	3402823368704.00
update t1 set f1 = -3.40282e38 where f1 >= 1070000000000;
select * from t1 order by id;
id	f1	f2	f3	f4
-3.40282e38	-3.40282e38	-34028235259904.00	0.01	0.01
-1.75e22	-3e38	1111111106560.00	0	0.00
-0.000000000123456	1070000000000	-12345679020032.00	0.000000000123456	12345679020032.00
-1.17549e-38	1070000000000	-11754943807488.00	1.79435e-38	175494352.00
1.17549e-38	-380000000000	12866054782976.00	3e38	1175494400.00
0.111111	-380000000000	1111111106560.00	0.111111	0.11
1234.57	-380000000000	1111111106560.00	1234.57	1234.56
1.23456e17	-3.40282e38	NULL	1.23456e17	NULL
1.75e22	-3.40282e38	0.00	0	0.00
6.894e34	-3.40282e38	1115934425088.00	6.894e34	4823348224.00
3.40282e38	-3.40282e38	4513934606336.00	3.40282e38	3402823368704.00
update t1 set f1 = 3.40282e38 where f1 <= -380000000000;
select * from t1 order by id;
id	f1	f2	f3	f4
-3.40282e38	3.40282e38	-34028235259904.00	0.01	0.01
-1.75e22	3.40282e38	1111111106560.00	0	0.00
-0.000000000123456	1070000000000	-12345679020032.00	0.000000000123456	12345679020032.00
-1.17549e-38	1070000000000	-11754943807488.00	1.79435e-38	175494352.00
1.17549e-38	3.40282e38	12866054782976.00	3e38	1175494400.00
0.111111	3.40282e38	1111111106560.00	0.111111	0.11
1234.57	3.40282e38	1111111106560.00	1234.57	1234.56
1.23456e17	3.40282e38	NULL	1.23456e17	NULL
1.75e22	3.40282e38	0.00	0	0.00
6.894e34	3.40282e38	1115934425088.00	6.894e34	4823348224.00
3.40282e38	3.40282e38	4513934606336.00	3.40282e38	3402823368704.00
update t1 set f3 = 3.402823466E+38 where id < 0.1;
select * from t1 order by id;
id	f1	f2	f3	f4
-3.40282e38	3.40282e38	-34028235259904.00	3.40282e38	0.01
-1.75e22	3.40282e38	1111111106560.00	3.40282e38	0.00
-0.000000000123456	1070000000000	-12345679020032.00	3.40282e38	12345679020032.00
-1.17549e-38	1070000000000	-11754943807488.00	3.40282e38	175494352.00
1.17549e-38	3.40282e38	12866054782976.00	3.40282e38	1175494400.00
0.111111	3.40282e38	1111111106560.00	0.111111	0.11
1234.57	3.40282e38	1111111106560.00	1234.57	1234.56
1.23456e17	3.40282e38	NULL	1.23456e17	NULL
1.75e22	3.40282e38	0.00	0	0.00
6.894e34	3.40282e38	1115934425088.00	6.894e34	4823348224.00
3.40282e38	3.40282e38	4513934606336.00	3.40282e38	3402823368704.00
update t1 set f4 = 0 where id > 6e34;
drop table t1;
create table t1 ( id double primary key, d1 double, d2 double(20,2), d3 double unsigned, d4 double(20,2) unsigned );
insert into t1 values (-1.7976931348623157E+308, -1.7976931348623157E+308, -17976931348623157.99, 0.000001, 0.01);
insert into t1 values (0.1111111, 0.1111111, 0.11, 0.1111111, 0.11);
insert into t1 values (1234.56789, 1234.56789, 1234.56, 1234.56789, 1234.56);
insert into t1 values (-2.2250738585072014E-308, -2.2250738585072014E-308, -22250738585072014.11, 2.2250738585072014, 22250738585072014.11);
insert into t1 values (2.2250738585072014E-308, 2.2250738585072014E-308, 22250738585072014, 2.2250738585072014E-308, 22250738585072014);
insert into t1 values (1.7976931348623157E+308, 1.7976931348623157E+308, 17976931348623157, 1.7976931348623157E+308, 17976931348623157);
insert into t1 values (68940E+30, 68940E+30, 4823348320.2, 68940E+30, 4823348320.2);
insert into t1 values (0, 0, 0, 0, 0);
insert into t1 values (1, 0, 0, 1, 1);
insert into t1 values (123.456E+15, 123.456E+15, NULL, 123.456E+15, NULL);
insert into t1 values (-123456E-15, -123456E-15, -12345678998765.55, 123456E-15, 12345678998765.55);
update t1 set id = id - 8E300 where id < -0.1;
ERROR 22003: Out of range value for column 'id' at row 1
update t1 set id = id + 8E+300 where id > 3.40282e35;
ERROR 22003: Out of range value for column 'id' at row 1
update t1 set d2 = d2 + 11E+30 where id < 1;
ERROR 22003: Out of range value for column 'd2' at row 1
update t1 set d1 = d1 - 1.7976931348623157E+308 where id = 0;
update t1 set d1 = d1 + 1.7976931348623157E+308 where id = 1;
select * from t1 order by id;
id	d1	d2	d3	d4
-1.7976931348623157e308	-1.7976931348623157e308	-17976931348623158.00	0.000001	0.01
-0.000000000123456	-0.000000000123456	-12345678998765.55	0.000000000123456	12345678998765.55
-2.2250738585072014e-308	-2.2250738585072014e-308	-22250738585072016.00	2.2250738585072014	22250738585072016.00
0	-1.7976931348623157e308	0.00	0	0.00
2.2250738585072014e-308	2.2250738585072014e-308	22250738585072016.00	2.2250738585072014e-308	22250738585072016.00
0.1111111	0.1111111	0.11	0.1111111	0.11
1	1.7976931348623157e308	0.00	1	1.00
1234.56789	1234.56789	1234.56	1234.56789	1234.56
1.23456e17	1.23456e17	NULL	1.23456e17	NULL
6.894e34	6.894e34	4823348320.20	6.894e34	4823348320.20
1.7976931348623157e308	1.7976931348623157e308	17976931348623156.00	1.7976931348623157e308	17976931348623156.00
update t1 set d1 = d1 - 179E+10 where id > 0;
update t1 set d1 = d1 + 10E+10 where id < 0;
select * from t1 order by id;
id	d1	d2	d3	d4
-1.7976931348623157e308	-1.7976931348623157e308	-17976931348623158.00	0.000001	0.01
-0.000000000123456	100000000000	-12345678998765.55	0.000000000123456	12345678998765.55
-2.2250738585072014e-308	100000000000	-22250738585072016.00	2.2250738585072014	22250738585072016.00
0	-1.7976931348623157e308	0.00	0	0.00
2.2250738585072014e-308	-1790000000000	22250738585072016.00	2.2250738585072014e-308	22250738585072016.00
0.1111111	-1789999999999.889	0.11	0.1111111	0.11
1	1.7976931348623157e308	0.00	1	1.00
1234.56789	-1789999998765.4321	1234.56	1234.56789	1234.56
1.23456e17	1.2345421e17	NULL	1.23456e17	NULL
6.894e34	6.894e34	4823348320.20	6.894e34	4823348320.20
1.7976931348623157e308	1.7976931348623157e308	17976931348623156.00	1.7976931348623157e308	17976931348623156.00
update t1 set d2 = d2 - 0.11 where d1 < 0;
select * from t1 order by id;
id	d1	d2	d3	d4
-1.7976931348623157e308	-1.7976931348623157e308	-17976931348623158.00	0.000001	0.01
-0.000000000123456	100000000000	-12345678998765.55	0.000000000123456	12345678998765.55
-2.2250738585072014e-308	100000000000	-22250738585072016.00	2.2250738585072014	22250738585072016.00
0	-1.7976931348623157e308	-0.11	0	0.00
2.2250738585072014e-308	-1790000000000	22250738585072016.00	2.2250738585072014e-308	22250738585072016.00
0.1111111	-1789999999999.889	0.00	0.1111111	0.11
1	1.7976931348623157e308	0.00	1	1.00
1234.56789	-1789999998765.4321	1234.45	1234.56789	1234.56
1.23456e17	1.2345421e17	NULL	1.23456e17	NULL
6.894e34	6.894e34	4823348320.20	6.894e34	4823348320.20
1.7976931348623157e308	1.7976931348623157e308	17976931348623156.00	1.7976931348623157e308	17976931348623156.00
update t1 set d2 = d2 + 1111111111111 where id > 0;
select * from t1 order by id;
id	d1	d2	d3	d4
-1.7976931348623157e308	-1.7976931348623157e308	-17976931348623158.00	0.000001	0.01
-0.000000000123456	100000000000	-12345678998765.55	0.000000000123456	12345678998765.55
-2.2250738585072014e-308	100000000000	-22250738585072016.00	2.2250738585072014	22250738585072016.00
0	-1.7976931348623157e308	-0.11	0	0.00
2.2250738585072014e-308	-1790000000000	22251849696183130.00	2.2250738585072014e-308	22250738585072016.00
0.1111111	-1789999999999.889	1111111111111.00	0.1111111	0.11
1	1.7976931348623157e308	1111111111111.00	1	1.00
1234.56789	-1789999998765.4321	1111111112345.45	1234.56789	1234.56
1.23456e17	1.2345421e17	NULL	1.23456e17	NULL
6.894e34	6.894e34	1115934459431.20	6.894e34	4823348320.20
1.7976931348623157e308	1.7976931348623157e308	17978042459734268.00	1.7976931348623157e308	17976931348623156.00
update t1 set d3 = d3 + 1.7976931348623157e308 where id = 0;
select * from t1 order by id;
id	d1	d2	d3	d4
-1.7976931348623157e308	-1.7976931348623157e308	-17976931348623158.00	0.000001	0.01
-0.000000000123456	100000000000	-12345678998765.55	0.000000000123456	12345678998765.55
-2.2250738585072014e-308	100000000000	-22250738585072016.00	2.2250738585072014	22250738585072016.00
0	-1.7976931348623157e308	-0.11	1.7976931348623157e308	0.00
2.2250738585072014e-308	-1790000000000	22251849696183130.00	2.2250738585072014e-308	22250738585072016.00
0.1111111	-1789999999999.889	1111111111111.00	0.1111111	0.11
1	1.7976931348623157e308	1111111111111.00	1	1.00
1234.56789	-1789999998765.4321	1111111112345.45	1234.56789	1234.56
1.23456e17	1.2345421e17	NULL	1.23456e17	NULL
6.894e34	6.894e34	1115934459431.20	6.894e34	4823348320.20
1.7976931348623157e308	1.7976931348623157e308	17978042459734268.00	1.7976931348623157e308	17976931348623156.00
update t1 set d4 = d4 - 17976931348623156.00 where d3 > 2e38 and d4 > 0;
select * from t1 order by id;
id	d1	d2	d3	d4
-1.7976931348623157e308	-1.7976931348623157e308	-17976931348623158.00	0.000001	0.01
-0.000000000123456	100000000000	-12345678998765.55	0.000000000123456	12345678998765.55
-2.2250738585072014e-308	100000000000	-22250738585072016.00	2.2250738585072014	22250738585072016.00
0	-1.7976931348623157e308	-0.11	1.7976931348623157e308	0.00
2.2250738585072014e-308	-1790000000000	22251849696183130.00	2.2250738585072014e-308	22250738585072016.00
0.1111111	-1789999999999.889	1111111111111.00	0.1111111	0.11
1	1.7976931348623157e308	1111111111111.00	1	1.00
1234.56789	-1789999998765.4321	1111111112345.45	1234.56789	1234.56
1.23456e17	1.2345421e17	NULL	1.23456e17	NULL
6.894e34	6.894e34	1115934459431.20	6.894e34	4823348320.20
1.7976931348623157e308	1.7976931348623157e308	17978042459734268.00	1.7976931348623157e308	0.00
update t1 set id = 179E+208 where id = 0;
select * from t1 order by id;
id	d1	d2	d3	d4
-1.7976931348623157e308	-1.7976931348623157e308	-17976931348623158.00	0.000001	0.01
-0.000000000123456	100000000000	-12345678998765.55	0.000000000123456	12345678998765.55
-2.2250738585072014e-308	100000000000	-22250738585072016.00	2.2250738585072014	22250738585072016.00
2.2250738585072014e-308	-1790000000000	22251849696183130.00	2.2250738585072014e-308	22250738585072016.00
0.1111111	-1789999999999.889	1111111111111.00	0.1111111	0.11
1	1.7976931348623157e308	1111111111111.00	1	1.00
1234.56789	-1789999998765.4321	1111111112345.45	1234.56789	1234.56
1.23456e17	1.2345421e17	NULL	1.23456e17	NULL
6.894e34	6.894e34	1115934459431.20	6.894e34	4823348320.20
1.79e210	-1.7976931348623157e308	-0.11	1.7976931348623157e308	0.00
1.7976931348623157e308	1.7976931348623157e308	17978042459734268.00	1.7976931348623157e308	0.00
update t1 set id = -179E+208 where id = 1;
select * from t1 order by id;
id	d1	d2	d3	d4
-1.7976931348623157e308	-1.7976931348623157e308	-17976931348623158.00	0.000001	0.01
-1.79e210	1.7976931348623157e308	1111111111111.00	1	1.00
-0.000000000123456	100000000000	-12345678998765.55	0.000000000123456	12345678998765.55
-2.2250738585072014e-308	100000000000	-22250738585072016.00	2.2250738585072014	22250738585072016.00
2.2250738585072014e-308	-1790000000000	22251849696183130.00	2.2250738585072014e-308	22250738585072016.00
0.1111111	-1789999999999.889	1111111111111.00	0.1111111	0.11
1234.56789	-1789999998765.4321	1111111112345.45	1234.56789	1234.56
1.23456e17	1.2345421e17	NULL	1.23456e17	NULL
6.894e34	6.894e34	1115934459431.20	6.894e34	4823348320.20
1.79e210	-1.7976931348623157e308	-0.11	1.7976931348623157e308	0.00
1.7976931348623157e308	1.7976931348623157e308	17978042459734268.00	1.7976931348623157e308	0.00
update t1 set d1 = -1.7976931348623157e308 where d1 >= 1790000000000;
select * from t1 order by id;
id	d1	d2	d3	d4
-1.7976931348623157e308	-1.7976931348623157e308	-17976931348623158.00	0.000001	0.01
-1.79e210	-1.7976931348623157e308	1111111111111.00	1	1.00
-0.000000000123456	100000000000	-12345678998765.55	0.000000000123456	12345678998765.55
-2.2250738585072014e-308	100000000000	-22250738585072016.00	2.2250738585072014	22250738585072016.00
2.2250738585072014e-308	-1790000000000	22251849696183130.00	2.2250738585072014e-308	22250738585072016.00
0.1111111	-1789999999999.889	1111111111111.00	0.1111111	0.11
1234.56789	-1789999998765.4321	1111111112345.45	1234.56789	1234.56
1.23456e17	-1.7976931348623157e308	NULL	1.23456e17	NULL
6.894e34	-1.7976931348623157e308	1115934459431.20	6.894e34	4823348320.20
1.79e210	-1.7976931348623157e308	-0.11	1.7976931348623157e308	0.00
1.7976931348623157e308	-1.7976931348623157e308	17978042459734268.00	1.7976931348623157e308	0.00
update t1 set d1 = 1.7976931348623157e308 where d2 <= -1790000000000;
select * from t1 order by id;
id	d1	d2	d3	d4
-1.7976931348623157e308	1.7976931348623157e308	-17976931348623158.00	0.000001	0.01
-1.79e210	-1.7976931348623157e308	1111111111111.00	1	1.00
-0.000000000123456	1.7976931348623157e308	-12345678998765.55	0.000000000123456	12345678998765.55
-2.2250738585072014e-308	1.7976931348623157e308	-22250738585072016.00	2.2250738585072014	22250738585072016.00
2.2250738585072014e-308	-1790000000000	22251849696183130.00	2.2250738585072014e-308	22250738585072016.00
0.1111111	-1789999999999.889	1111111111111.00	0.1111111	0.11
1234.56789	-1789999998765.4321	1111111112345.45	1234.56789	1234.56
1.23456e17	-1.7976931348623157e308	NULL	1.23456e17	NULL
6.894e34	-1.7976931348623157e308	1115934459431.20	6.894e34	4823348320.20
1.79e210	-1.7976931348623157e308	-0.11	1.7976931348623157e308	0.00
1.7976931348623157e308	-1.7976931348623157e308	17978042459734268.00	1.7976931348623157e308	0.00
update t1 set d3 = 1.7976931348623157e308 where id > 2e30;
select * from t1 order by id;
id	d1	d2	d3	d4
-1.7976931348623157e308	1.7976931348623157e308	-17976931348623158.00	0.000001	0.01
-1.79e210	-1.7976931348623157e308	1111111111111.00	1	1.00
-0.000000000123456	1.7976931348623157e308	-12345678998765.55	0.000000000123456	12345678998765.55
-2.2250738585072014e-308	1.7976931348623157e308	-22250738585072016.00	2.2250738585072014	22250738585072016.00
2.2250738585072014e-308	-1790000000000	22251849696183130.00	2.2250738585072014e-308	22250738585072016.00
0.1111111	-1789999999999.889	1111111111111.00	0.1111111	0.11
1234.56789	-1789999998765.4321	1111111112345.45	1234.56789	1234.56
1.23456e17	-1.7976931348623157e308	NULL	1.23456e17	NULL
6.894e34	-1.7976931348623157e308	1115934459431.20	1.7976931348623157e308	4823348320.20
1.79e210	-1.7976931348623157e308	-0.11	1.7976931348623157e308	0.00
1.7976931348623157e308	-1.7976931348623157e308	17978042459734268.00	1.7976931348623157e308	0.00
update t1 set d4 = 0 where id < 0;
drop table t1;
create table t1 ( id decimal primary key, d1 decimal, d2 decimal(20,2), d3 decimal unsigned, d4 decimal(20,2) );
insert into t1 values (-9999999999, -9999999999, -99999999999999999.99, 9, 9.99);
insert into t1 values (2.2222222222, 2.2222222222, 2.22, 2.2222222222, 2.22);
Warnings:
Note	1265	Data truncated for column 'id' at row 1
Note	1265	Data truncated for column 'd1' at row 1
Note	1265	Data truncated for column 'd3' at row 1
insert into t1 values (1234.56789, 1234.56789, 1234.56, 1234.56789, 1234.56);
Warnings:
Note	1265	Data truncated for column 'id' at row 1
Note	1265	Data truncated for column 'd1' at row 1
Note	1265	Data truncated for column 'd3' at row 1
insert into t1 values (-1.175494351, -1.175494351, -11754943599999.11, 1.175494351, 11754943599999.11);
Warnings:
Note	1265	Data truncated for column 'id' at row 1
Note	1265	Data truncated for column 'd1' at row 1
Note	1265	Data truncated for column 'd3' at row 1
insert into t1 values (1.175494351, 1.175494351, 11754943599999.11, 1.175494351, 11754943599999.11);
Warnings:
Note	1265	Data truncated for column 'id' at row 1
Note	1265	Data truncated for column 'd1' at row 1
Note	1265	Data truncated for column 'd3' at row 1
insert into t1 values (3.402823466351, 3.402823466351, 3402823466351, 3.402823466351, 3402823466351);
Warnings:
Note	1265	Data truncated for column 'id' at row 1
Note	1265	Data truncated for column 'd1' at row 1
Note	1265	Data truncated for column 'd3' at row 1
insert into t1 values (689403, 689403, 4823348320.2, 689403, 4823348320.2);
insert into t1 values (0, 0, 0, 0, 0);
insert into t1 values (10, 0, 0, 0, 0);
insert into t1 values (123456, 123456, NULL, 123456, NULL);
insert into t1 values (9999999999, 9999999999, 99999999999999999.99, 9999999999, 99999999999999999.99);
update t1 set id = id - 1 where id < -1;
ERROR 22003: Out of range value for column 'id' at row 1
update t1 set id = id + 1 where id > 10e8;
ERROR 22003: Out of range value for column 'id' at row 1
update t1 set d2 = d2 - 11111111111111111111 where id < 0;
ERROR 22003: Out of range value for column 'd2' at row 1
update t1 set d3 = d3 - 11111111111111111111 where id < 0;
ERROR 22003: Out of range value for column 'd3' at row 1
update t1 set d1 = d1 - 9999999999 where id = 0;
update t1 set d1 = d1 + 9999999999 where id = 10;
select * from t1 order by id;
id	d1	d2	d3	d4
-9999999999	-9999999999	-99999999999999999.99	9	9.99
-1	-1	-11754943599999.11	1	11754943599999.11
0	-9999999999	0.00	0	0.00
1	1	11754943599999.11	1	11754943599999.11
2	2	2.22	2	2.22
3	3	3402823466351.00	3	3402823466351.00
10	9999999999	0.00	0	0.00
1235	1235	1234.56	1235	1234.56
123456	123456	NULL	123456	NULL
689403	689403	4823348320.20	689403	4823348320.20
9999999999	9999999999	99999999999999999.99	9999999999	99999999999999999.99
update t1 set d1 = d1 + 19999999998 where id = 0;
update t1 set d1 = d1 - 19999999998 where id = 10;
select * from t1 order by id;
id	d1	d2	d3	d4
-9999999999	-9999999999	-99999999999999999.99	9	9.99
-1	-1	-11754943599999.11	1	11754943599999.11
0	9999999999	0.00	0	0.00
1	1	11754943599999.11	1	11754943599999.11
2	2	2.22	2	2.22
3	3	3402823466351.00	3	3402823466351.00
10	-9999999999	0.00	0	0.00
1235	1235	1234.56	1235	1234.56
123456	123456	NULL	123456	NULL
689403	689403	4823348320.20	689403	4823348320.20
9999999999	9999999999	99999999999999999.99	9999999999	99999999999999999.99
update t1 set d1 = d1 + 3E+9 where d1 < 100000;
update t1 set d1 = d1 - 3E+9 where d1 > -100000;
select * from t1 order by id;
id	d1	d2	d3	d4
-9999999999	-6999999999	-99999999999999999.99	9	9.99
-1	-1	-11754943599999.11	1	11754943599999.11
0	6999999999	0.00	0	0.00
1	1	11754943599999.11	1	11754943599999.11
2	2	2.22	2	2.22
3	3	3402823466351.00	3	3402823466351.00
10	-6999999999	0.00	0	0.00
1235	1235	1234.56	1235	1234.56
123456	-2999876544	NULL	123456	NULL
689403	-2999310597	4823348320.20	689403	4823348320.20
9999999999	6999999999	99999999999999999.99	9999999999	99999999999999999.99
update t1 set d2 = d2 - 2.22 where d1 < 0;
select * from t1 order by id;
id	d1	d2	d3	d4
-9999999999	-6999999999	-100000000000000002.21	9	9.99
-1	-1	-11754943600001.33	1	11754943599999.11
0	6999999999	0.00	0	0.00
1	1	11754943599999.11	1	11754943599999.11
2	2	2.22	2	2.22
3	3	3402823466351.00	3	3402823466351.00
10	-6999999999	-2.22	0	0.00
1235	1235	1234.56	1235	1234.56
123456	-2999876544	NULL	123456	NULL
689403	-2999310597	4823348317.98	689403	4823348320.20
9999999999	6999999999	99999999999999999.99	9999999999	99999999999999999.99
update t1 set id = 15E+8 where id = 0;
select * from t1 order by id;
id	d1	d2	d3	d4
-9999999999	-6999999999	-100000000000000002.21	9	9.99
-1	-1	-11754943600001.33	1	11754943599999.11
1	1	11754943599999.11	1	11754943599999.11
2	2	2.22	2	2.22
3	3	3402823466351.00	3	3402823466351.00
10	-6999999999	-2.22	0	0.00
1235	1235	1234.56	1235	1234.56
123456	-2999876544	NULL	123456	NULL
689403	-2999310597	4823348317.98	689403	4823348320.20
1500000000	6999999999	0.00	0	0.00
9999999999	6999999999	99999999999999999.99	9999999999	99999999999999999.99
update t1 set id = -15E+8 where id = 1;
select * from t1 order by id;
id	d1	d2	d3	d4
-9999999999	-6999999999	-100000000000000002.21	9	9.99
-1500000000	1	11754943599999.11	1	11754943599999.11
-1	-1	-11754943600001.33	1	11754943599999.11
2	2	2.22	2	2.22
3	3	3402823466351.00	3	3402823466351.00
10	-6999999999	-2.22	0	0.00
1235	1235	1234.56	1235	1234.56
123456	-2999876544	NULL	123456	NULL
689403	-2999310597	4823348317.98	689403	4823348320.20
1500000000	6999999999	0.00	0	0.00
9999999999	6999999999	99999999999999999.99	9999999999	99999999999999999.99
update t1 set d3 = d3 - 9999999999 where id = 9999999999;
select * from t1 order by id;
id	d1	d2	d3	d4
-9999999999	-6999999999	-100000000000000002.21	9	9.99
-1500000000	1	11754943599999.11	1	11754943599999.11
-1	-1	-11754943600001.33	1	11754943599999.11
2	2	2.22	2	2.22
3	3	3402823466351.00	3	3402823466351.00
10	-6999999999	-2.22	0	0.00
1235	1235	1234.56	1235	1234.56
123456	-2999876544	NULL	123456	NULL
689403	-2999310597	4823348317.98	689403	4823348320.20
1500000000	6999999999	0.00	0	0.00
9999999999	6999999999	99999999999999999.99	0	99999999999999999.99
update t1 set d4 = d4 + 999999999999999999.99 where id = 10;
select * from t1 order by id;
id	d1	d2	d3	d4
-9999999999	-6999999999	-100000000000000002.21	9	9.99
-1500000000	1	11754943599999.11	1	11754943599999.11
-1	-1	-11754943600001.33	1	11754943599999.11
2	2	2.22	2	2.22
3	3	3402823466351.00	3	3402823466351.00
10	-6999999999	-2.22	0	999999999999999999.99
1235	1235	1234.56	1235	1234.56
123456	-2999876544	NULL	123456	NULL
689403	-2999310597	4823348317.98	689403	4823348320.20
1500000000	6999999999	0.00	0	0.00
9999999999	6999999999	99999999999999999.99	0	99999999999999999.99
update t1 set d1 = -9999999999 where d1 >= 1070000;
select * from t1 order by id;
id	d1	d2	d3	d4
-9999999999	-6999999999	-100000000000000002.21	9	9.99
-1500000000	1	11754943599999.11	1	11754943599999.11
-1	-1	-11754943600001.33	1	11754943599999.11
2	2	2.22	2	2.22
3	3	3402823466351.00	3	3402823466351.00
10	-6999999999	-2.22	0	999999999999999999.99
1235	1235	1234.56	1235	1234.56
123456	-2999876544	NULL	123456	NULL
689403	-2999310597	4823348317.98	689403	4823348320.20
1500000000	-9999999999	0.00	0	0.00
9999999999	-9999999999	99999999999999999.99	0	99999999999999999.99
update t1 set d1 = 9999999999 where d2 <= -117549435;
select * from t1 order by id;
id	d1	d2	d3	d4
-9999999999	9999999999	-100000000000000002.21	9	9.99
-1500000000	1	11754943599999.11	1	11754943599999.11
-1	9999999999	-11754943600001.33	1	11754943599999.11
2	2	2.22	2	2.22
3	3	3402823466351.00	3	3402823466351.00
10	-6999999999	-2.22	0	999999999999999999.99
1235	1235	1234.56	1235	1234.56
123456	-2999876544	NULL	123456	NULL
689403	-2999310597	4823348317.98	689403	4823348320.20
1500000000	-9999999999	0.00	0	0.00
9999999999	-9999999999	99999999999999999.99	0	99999999999999999.99
update t1 set d3 = 9999999999 where id > 0;
select * from t1 order by id;
id	d1	d2	d3	d4
-9999999999	9999999999	-100000000000000002.21	9	9.99
-1500000000	1	11754943599999.11	1	11754943599999.11
-1	9999999999	-11754943600001.33	1	11754943599999.11
2	2	2.22	9999999999	2.22
3	3	3402823466351.00	9999999999	3402823466351.00
10	-6999999999	-2.22	9999999999	999999999999999999.99
1235	1235	1234.56	9999999999	1234.56
123456	-2999876544	NULL	9999999999	NULL
689403	-2999310597	4823348317.98	9999999999	4823348320.20
1500000000	-9999999999	0.00	9999999999	0.00
9999999999	-9999999999	99999999999999999.99	9999999999	99999999999999999.99
update t1 set d4 = 999999999999999999.99 where id < 0;
select * from t1 order by id;
id	d1	d2	d3	d4
-9999999999	9999999999	-100000000000000002.21	9	999999999999999999.99
-1500000000	1	11754943599999.11	1	999999999999999999.99
-1	9999999999	-11754943600001.33	1	999999999999999999.99
2	2	2.22	9999999999	2.22
3	3	3402823466351.00	9999999999	3402823466351.00
10	-6999999999	-2.22	9999999999	999999999999999999.99
1235	1235	1234.56	9999999999	1234.56
123456	-2999876544	NULL	9999999999	NULL
689403	-2999310597	4823348317.98	9999999999	4823348320.20
1500000000	-9999999999	0.00	9999999999	0.00
9999999999	-9999999999	99999999999999999.99	9999999999	99999999999999999.99
drop table t1;
DROP DATABASE inc_sequoiadb;
