drop table if exists t0, t1, t2, t3, t4;
set @save_optimizer_switch=@@optimizer_switch;
set optimizer_switch='semijoin=on,materialization=on';
set optimizer_switch='mrr=on,mrr_sort_keys=on,index_condition_pushdown=on';
create table t0 (a int);
insert into t0 values (0),(1),(2),(3),(4),(5),(6),(7),(8),(9);
create table t1 as select * from t0;
# The following should use full scan on <subquery2> and it must scan 1 row:
select * from t0 where a in (select max(a) from t1);
a
9
insert into t1 values (11);
select * from t0 where a in (select max(a) from t1);
a
delete from t1 where a=11;
insert into t0 values (NULL);
select * from t0 where a in (select max(a) from t1);
a
9
delete from t0 where a is NULL;
delete from t1;
select * from t0 where a in (select max(a) from t1);
a
insert into t0 values (NULL);
select * from t0 where a in (select max(a) from t1);
a
delete from t0 where a is NULL;
drop table t1;
#
# BUG#780359: Crash with get_fanout_with_deps in maria-5.3-mwl90
#
CREATE TABLE t1 (f1 int);
INSERT INTO t1 VALUES (2),(2);
CREATE TABLE t2 (f3 int);
INSERT INTO t2 VALUES (2),(2);
SELECT *
FROM t1
WHERE ( f1 ) IN (
SELECT t2.f3
FROM t2
WHERE t2.f3 = 97
AND t2.f3 = 50
GROUP BY 1
);
f1
DROP TABLE t1, t2;
drop table t0;
set optimizer_switch=@save_optimizer_switch;
