set global log_output = "TABLE";
set session long_query_time = 0;
set session sequoiadb_support_mode = '';
set global slow_query_log = off;
set global general_log = off;
drop database if exists slow_log_sequoiadb;
drop table if exists mysql.slow_log;
drop table if exists mysql.general_log;
use mysql;
CREATE TABLE `slow_log` (
`start_time` timestamp(6) NOT NULL DEFAULT current_timestamp(6) ON UPDATE current_timestamp(6),
`user_host` mediumtext NOT NULL,
`query_time` time(6) NOT NULL,
`lock_time` time(6) NOT NULL,
`rows_sent` int(11) NOT NULL,
`rows_examined` int(11) NOT NULL,
`db` varchar(512) NOT NULL,
`last_insert_id` int(11) NOT NULL,
`insert_id` int(11) NOT NULL,
`server_id` int(10) unsigned NOT NULL,
`sql_text` mediumtext NOT NULL,
`thread_id` bigint(21) unsigned NOT NULL,
`rows_affected` int(11) NOT NULL
) ENGINE=SequoiaDB DEFAULT CHARSET=utf8 COMMENT='Slow log,sequoiadb:{table_options: {NoTrans:true}}';
CREATE TABLE `general_log` (
`event_time` timestamp(6) NOT NULL DEFAULT current_timestamp(6) ON UPDATE current_timestamp(6),
`user_host` mediumtext NOT NULL,
`thread_id` bigint(21) unsigned NOT NULL,
`server_id` int(10) unsigned NOT NULL,
`command_type` varchar(64) NOT NULL,
`argument` mediumtext NOT NULL
) ENGINE=SequoiaDB DEFAULT CHARSET=utf8 COMMENT='General log,sequoiadb:{table_options: {NoTrans:true}}';
truncate table slow_log;
truncate table general_log;
create database slow_log_sequoiadb;
use slow_log_sequoiadb;
set global slow_query_log = on;
set global general_log = on;
create table t1(id int);
set global slow_query_log = off;
set global general_log = off;
create table t2(id int);
set global slow_query_log = on;
set global general_log = on;
create table t3(id int);
select * from mysql.slow_log;
start_time	user_host	query_time	lock_time	rows_sent	rows_examined	db	last_insert_id	insert_id	server_id	sql_text	thread_id	rows_affected
TIMESTAMP	USER_HOST	QUERY_TIME	LOCK_TIME	0	0	slow_log_sequoiadb	0	0	1	set global slow_query_log = on	THREAD_ID	ROWS_AFFECTED
TIMESTAMP	USER_HOST	QUERY_TIME	LOCK_TIME	0	0	slow_log_sequoiadb	0	0	1	set global general_log = on	THREAD_ID	ROWS_AFFECTED
TIMESTAMP	USER_HOST	QUERY_TIME	LOCK_TIME	0	0	slow_log_sequoiadb	0	0	1	create table t1(id int)	THREAD_ID	ROWS_AFFECTED
TIMESTAMP	USER_HOST	QUERY_TIME	LOCK_TIME	0	0	slow_log_sequoiadb	0	0	1	set global slow_query_log = on	THREAD_ID	ROWS_AFFECTED
TIMESTAMP	USER_HOST	QUERY_TIME	LOCK_TIME	0	0	slow_log_sequoiadb	0	0	1	set global general_log = on	THREAD_ID	ROWS_AFFECTED
TIMESTAMP	USER_HOST	QUERY_TIME	LOCK_TIME	0	0	slow_log_sequoiadb	0	0	1	create table t3(id int)	THREAD_ID	ROWS_AFFECTED
select * from mysql.general_log;
event_time	user_host	thread_id	server_id	command_type	argument
TIMESTAMP	USER_HOST	THREAD_ID	1	Query	create table t1(id int)
TIMESTAMP	USER_HOST	THREAD_ID	1	Query	set global slow_query_log = off
TIMESTAMP	USER_HOST	THREAD_ID	1	Query	set global general_log = off
TIMESTAMP	USER_HOST	THREAD_ID	1	Query	create table t3(id int)
TIMESTAMP	USER_HOST	THREAD_ID	1	Query	select * from mysql.slow_log
TIMESTAMP	USER_HOST	THREAD_ID	1	Query	select * from mysql.general_log
set global slow_query_log = off;
set global general_log =off;
use mysql;
drop table slow_log, general_log;
CREATE TABLE `slow_log` (
`start_time` timestamp(6) NOT NULL DEFAULT current_timestamp(6) ON UPDATE current_timestamp(6),
`user_host` mediumtext NOT NULL,
`query_time` time(6) NOT NULL,
`lock_time` time(6) NOT NULL,
`rows_sent` int(11) NOT NULL,
`rows_examined` int(11) NOT NULL,
`db` varchar(512) NOT NULL,
`last_insert_id` int(11) NOT NULL,
`insert_id` int(11) NOT NULL,
`server_id` int(10) unsigned NOT NULL,
`sql_text` mediumtext NOT NULL,
`thread_id` bigint(21) unsigned NOT NULL,
`rows_affected` int(11) NOT NULL
) ENGINE=CSV DEFAULT CHARSET=utf8 COMMENT='Slow log';
CREATE TABLE `general_log` (
`event_time` timestamp(6) NOT NULL DEFAULT current_timestamp(6) ON UPDATE current_timestamp(6),
`user_host` mediumtext NOT NULL,
`thread_id` bigint(21) unsigned NOT NULL,
`server_id` int(10) unsigned NOT NULL,
`command_type` varchar(64) NOT NULL,
`argument` mediumtext NOT NULL
) ENGINE=CSV DEFAULT CHARSET=utf8 COMMENT='General log';
set global slow_query_log = on;
set global general_log = on;
use slow_log_sequoiadb;
create table t4(id int);
select * from mysql.slow_log;
start_time	user_host	query_time	lock_time	rows_sent	rows_examined	db	last_insert_id	insert_id	server_id	sql_text	thread_id	rows_affected
TIMESTAMP	USER_HOST	QUERY_TIME	LOCK_TIME	0	0	mysql	0	0	1	set global slow_query_log = on	THREAD_ID	ROWS_AFFECTED
TIMESTAMP	USER_HOST	QUERY_TIME	LOCK_TIME	0	0	mysql	0	0	1	set global general_log = on	THREAD_ID	ROWS_AFFECTED
TIMESTAMP	USER_HOST	QUERY_TIME	LOCK_TIME	0	0	slow_log_sequoiadb	0	0	1	use slow_log_sequoiadb	THREAD_ID	ROWS_AFFECTED
TIMESTAMP	USER_HOST	QUERY_TIME	LOCK_TIME	0	0	slow_log_sequoiadb	0	0	1	create table t4(id int)	THREAD_ID	ROWS_AFFECTED
select * from mysql.general_log;
event_time	user_host	thread_id	server_id	command_type	argument
TIMESTAMP	USER_HOST	THREAD_ID	1	Query	use slow_log_sequoiadb
TIMESTAMP	USER_HOST	THREAD_ID	1	Query	create table t4(id int)
TIMESTAMP	USER_HOST	THREAD_ID	1	Query	select * from mysql.slow_log
TIMESTAMP	USER_HOST	THREAD_ID	1	Query	select * from mysql.general_log
set global slow_query_log = off;
set global general_log = off;
use mysql;
drop table slow_log, general_log;
CREATE TABLE `slow_log` (
`start_time` timestamp(6) NOT NULL DEFAULT current_timestamp(6) ON UPDATE current_timestamp(6),
`user_host` mediumtext NOT NULL,
`query_time` time(6) NOT NULL,
`lock_time` time(6) NOT NULL,
`rows_sent` int(11) NOT NULL,
`rows_examined` int(11) NOT NULL,
`db` varchar(512) NOT NULL,
`last_insert_id` int(11) NOT NULL,
`insert_id` int(11) NOT NULL,
`server_id` int(10) unsigned NOT NULL,
`sql_text` mediumtext NOT NULL,
`thread_id` bigint(21) unsigned NOT NULL,
`rows_affected` int(11) NOT NULL
) ENGINE=SequoiaDB DEFAULT CHARSET=utf8 COMMENT='Slow log,sequoiadb:{table_options: {NoTrans:true}}';
CREATE TABLE `general_log` (
`event_time` timestamp(6) NOT NULL DEFAULT current_timestamp(6) ON UPDATE current_timestamp(6),
`user_host` mediumtext NOT NULL,
`thread_id` bigint(21) unsigned NOT NULL,
`server_id` int(10) unsigned NOT NULL,
`command_type` varchar(64) NOT NULL,
`argument` mediumtext NOT NULL
) ENGINE=SequoiaDB DEFAULT CHARSET=utf8 COMMENT='General log,sequoiadb:{table_options: {NoTrans:true}}';
set global slow_query_log = on;
set global general_log = on;
use slow_log_sequoiadb;
create table t5(id int);
select * from mysql.slow_log;
start_time	user_host	query_time	lock_time	rows_sent	rows_examined	db	last_insert_id	insert_id	server_id	sql_text	thread_id	rows_affected
TIMESTAMP	USER_HOST	QUERY_TIME	LOCK_TIME	0	0	mysql	0	0	1	set global slow_query_log = on	THREAD_ID	ROWS_AFFECTED
TIMESTAMP	USER_HOST	QUERY_TIME	LOCK_TIME	0	0	mysql	0	0	1	set global general_log = on	THREAD_ID	ROWS_AFFECTED
TIMESTAMP	USER_HOST	QUERY_TIME	LOCK_TIME	0	0	slow_log_sequoiadb	0	0	1	use slow_log_sequoiadb	THREAD_ID	ROWS_AFFECTED
TIMESTAMP	USER_HOST	QUERY_TIME	LOCK_TIME	0	0	slow_log_sequoiadb	0	0	1	create table t5(id int)	THREAD_ID	ROWS_AFFECTED
select * from mysql.general_log;
event_time	user_host	thread_id	server_id	command_type	argument
TIMESTAMP	USER_HOST	THREAD_ID	1	Query	use slow_log_sequoiadb
TIMESTAMP	USER_HOST	THREAD_ID	1	Query	create table t5(id int)
TIMESTAMP	USER_HOST	THREAD_ID	1	Query	select * from mysql.slow_log
TIMESTAMP	USER_HOST	THREAD_ID	1	Query	select * from mysql.general_log
set global slow_query_log = off;
set global general_log = off;
use mysql;
drop table slow_log, general_log;
CREATE TABLE `slow_log` (
`start_time` timestamp(6) NOT NULL DEFAULT current_timestamp(6) ON UPDATE current_timestamp(6),
`user_host` mediumtext NOT NULL,
`query_time` time(6) NOT NULL,
`lock_time` time(6) NOT NULL,
`rows_sent` int(11) NOT NULL,
`rows_examined` int(11) NOT NULL,
`db` varchar(512) NOT NULL,
`last_insert_id` int(11) NOT NULL,
`insert_id` int(11) NOT NULL,
`server_id` int(10) unsigned NOT NULL,
`sql_text` mediumtext NOT NULL,
`thread_id` bigint(21) unsigned NOT NULL,
`rows_affected` int(11) NOT NULL
) ENGINE=CSV DEFAULT CHARSET=utf8 COMMENT='Slow log';
CREATE TABLE `general_log` (
`event_time` timestamp(6) NOT NULL DEFAULT current_timestamp(6) ON UPDATE current_timestamp(6),
`user_host` mediumtext NOT NULL,
`thread_id` bigint(21) unsigned NOT NULL,
`server_id` int(10) unsigned NOT NULL,
`command_type` varchar(64) NOT NULL,
`argument` mediumtext NOT NULL
) ENGINE=CSV DEFAULT CHARSET=utf8 COMMENT='General log';
set global slow_query_log = on;
set global general_log = on;
use slow_log_sequoiadb;
create table t6(id int);
select * from mysql.slow_log;
start_time	user_host	query_time	lock_time	rows_sent	rows_examined	db	last_insert_id	insert_id	server_id	sql_text	thread_id	rows_affected
TIMESTAMP	USER_HOST	QUERY_TIME	LOCK_TIME	0	0	mysql	0	0	1	set global slow_query_log = on	THREAD_ID	ROWS_AFFECTED
TIMESTAMP	USER_HOST	QUERY_TIME	LOCK_TIME	0	0	mysql	0	0	1	set global general_log = on	THREAD_ID	ROWS_AFFECTED
TIMESTAMP	USER_HOST	QUERY_TIME	LOCK_TIME	0	0	slow_log_sequoiadb	0	0	1	use slow_log_sequoiadb	THREAD_ID	ROWS_AFFECTED
TIMESTAMP	USER_HOST	QUERY_TIME	LOCK_TIME	0	0	slow_log_sequoiadb	0	0	1	create table t6(id int)	THREAD_ID	ROWS_AFFECTED
select * from mysql.general_log;
event_time	user_host	thread_id	server_id	command_type	argument
TIMESTAMP	USER_HOST	THREAD_ID	1	Query	use slow_log_sequoiadb
TIMESTAMP	USER_HOST	THREAD_ID	1	Query	create table t6(id int)
TIMESTAMP	USER_HOST	THREAD_ID	1	Query	select * from mysql.slow_log
TIMESTAMP	USER_HOST	THREAD_ID	1	Query	select * from mysql.general_log
set global server_id=10;
set global slow_query_log = off;
set global general_log = off;
use mysql;
drop table slow_log, general_log;
CREATE TABLE `slow_log` (
`start_time` timestamp(6) NOT NULL DEFAULT current_timestamp(6) ON UPDATE current_timestamp(6),
`user_host` mediumtext NOT NULL,
`query_time` time(6) NOT NULL,
`lock_time` time(6) NOT NULL,
`rows_sent` int(11) NOT NULL,
`rows_examined` int(11) NOT NULL,
`db` varchar(512) NOT NULL,
`last_insert_id` int(11) NOT NULL,
`insert_id` int(11) NOT NULL,
`server_id` int(10) unsigned NOT NULL,
`sql_text` mediumtext NOT NULL,
`thread_id` bigint(21) unsigned NOT NULL,
`rows_affected` int(11) NOT NULL
) ENGINE=SequoiaDB DEFAULT CHARSET=utf8 COMMENT='Slow log,sequoiadb:{table_options: {NoTrans:true}}';
CREATE TABLE `general_log` (
`event_time` timestamp(6) NOT NULL DEFAULT current_timestamp(6) ON UPDATE current_timestamp(6),
`user_host` mediumtext NOT NULL,
`thread_id` bigint(21) unsigned NOT NULL,
`server_id` int(10) unsigned NOT NULL,
`command_type` varchar(64) NOT NULL,
`argument` mediumtext NOT NULL
) ENGINE=SequoiaDB DEFAULT CHARSET=utf8 COMMENT='General log,sequoiadb:{table_options: {NoTrans:true}}';
set global slow_query_log = on;
set global general_log = on;
use slow_log_sequoiadb;
create table t7(id int);
select * from mysql.slow_log;
start_time	user_host	query_time	lock_time	rows_sent	rows_examined	db	last_insert_id	insert_id	server_id	sql_text	thread_id	rows_affected
TIMESTAMP	USER_HOST	QUERY_TIME	LOCK_TIME	0	0	mysql	0	0	10	set global slow_query_log = on	THREAD_ID	ROWS_AFFECTED
TIMESTAMP	USER_HOST	QUERY_TIME	LOCK_TIME	0	0	mysql	0	0	10	set global general_log = on	THREAD_ID	ROWS_AFFECTED
TIMESTAMP	USER_HOST	QUERY_TIME	LOCK_TIME	0	0	slow_log_sequoiadb	0	0	10	use slow_log_sequoiadb	THREAD_ID	ROWS_AFFECTED
TIMESTAMP	USER_HOST	QUERY_TIME	LOCK_TIME	0	0	slow_log_sequoiadb	0	0	10	create table t7(id int)	THREAD_ID	ROWS_AFFECTED
select * from mysql.general_log;
event_time	user_host	thread_id	server_id	command_type	argument
TIMESTAMP	USER_HOST	THREAD_ID	10	Query	use slow_log_sequoiadb
TIMESTAMP	USER_HOST	THREAD_ID	10	Query	create table t7(id int)
TIMESTAMP	USER_HOST	THREAD_ID	10	Query	select * from mysql.slow_log
TIMESTAMP	USER_HOST	THREAD_ID	10	Query	select * from mysql.general_log
set global slow_query_log = off;
set global general_log = off;
use mysql;
drop table slow_log, general_log;
CREATE TABLE `slow_log` (
`start_time` timestamp(6) NOT NULL DEFAULT current_timestamp(6) ON UPDATE current_timestamp(6),
`user_host` mediumtext NOT NULL,
`query_time` time(6) NOT NULL,
`lock_time` time(6) NOT NULL,
`rows_sent` int(11) NOT NULL,
`rows_examined` int(11) NOT NULL,
`db` varchar(512) NOT NULL,
`last_insert_id` int(11) NOT NULL,
`insert_id` int(11) NOT NULL,
`server_id` int(10) unsigned NOT NULL,
`sql_text` mediumtext NOT NULL,
`thread_id` bigint(21) unsigned NOT NULL,
`rows_affected` int(11) NOT NULL
) ENGINE=SequoiaDB DEFAULT CHARSET=utf8 COMMENT='Slow log,sequoiadb:{table_options: {NoTrans:true}}';
CREATE TABLE `general_log` (
`event_time` timestamp(6) NOT NULL DEFAULT current_timestamp(6) ON UPDATE current_timestamp(6),
`user_host` mediumtext NOT NULL,
`thread_id` bigint(21) unsigned NOT NULL,
`server_id` int(10) unsigned NOT NULL,
`command_type` varchar(64) NOT NULL,
`argument` mediumtext NOT NULL
) ENGINE=SequoiaDB DEFAULT CHARSET=utf8 COMMENT='General log,sequoiadb:{table_options: {NoTrans:true}}';
use slow_log_sequoiadb;
create table t8(id int);
begin;
insert into t8(id) values(1);
update t8 set id=2 where id=1;
commit;
set global slow_query_log = on;
set global general_log = on;
create table t9(id int);
select * from mysql.slow_log;
start_time	user_host	query_time	lock_time	rows_sent	rows_examined	db	last_insert_id	insert_id	server_id	sql_text	thread_id	rows_affected
TIMESTAMP	USER_HOST	QUERY_TIME	LOCK_TIME	0	0	slow_log_sequoiadb	0	0	10	set global slow_query_log = on	THREAD_ID	ROWS_AFFECTED
TIMESTAMP	USER_HOST	QUERY_TIME	LOCK_TIME	0	0	slow_log_sequoiadb	0	0	10	set global general_log = on	THREAD_ID	ROWS_AFFECTED
TIMESTAMP	USER_HOST	QUERY_TIME	LOCK_TIME	0	0	slow_log_sequoiadb	0	0	10	create table t9(id int)	THREAD_ID	ROWS_AFFECTED
select * from mysql.general_log;
event_time	user_host	thread_id	server_id	command_type	argument
TIMESTAMP	USER_HOST	THREAD_ID	10	Query	create table t9(id int)
TIMESTAMP	USER_HOST	THREAD_ID	10	Query	select * from mysql.slow_log
TIMESTAMP	USER_HOST	THREAD_ID	10	Query	select * from mysql.general_log
set global slow_query_log = off;
set global general_log = off;
use mysql;
drop table slow_log, general_log;
CREATE TABLE `slow_log` (
`start_time` timestamp(6) NOT NULL DEFAULT current_timestamp(6) ON UPDATE current_timestamp(6),
`user_host` mediumtext NOT NULL,
`query_time` time(6) NOT NULL,
`lock_time` time(6) NOT NULL,
`rows_sent` int(11) NOT NULL,
`rows_examined` int(11) NOT NULL,
`db` varchar(512) NOT NULL,
`last_insert_id` int(11) NOT NULL,
`insert_id` int(11) NOT NULL,
`server_id` int(10) unsigned NOT NULL,
`sql_text` mediumtext NOT NULL,
`thread_id` bigint(21) unsigned NOT NULL,
`rows_affected` int(11) NOT NULL
) ENGINE=SequoiaDB DEFAULT CHARSET=utf8 COMMENT='Slow log,sequoiadb:{table_options: {NoTrans:true}}';
CREATE TABLE `general_log` (
`event_time` timestamp(6) NOT NULL DEFAULT current_timestamp(6) ON UPDATE current_timestamp(6),
`user_host` mediumtext NOT NULL,
`thread_id` bigint(21) unsigned NOT NULL,
`server_id` int(10) unsigned NOT NULL,
`command_type` varchar(64) NOT NULL,
`argument` mediumtext NOT NULL
) ENGINE=SequoiaDB DEFAULT CHARSET=utf8 COMMENT='General log,sequoiadb:{table_options: {NoTrans:true}}';
use slow_log_sequoiadb;
create table t10(id int);
begin;
insert into t10(id) values(1);
update t10 set id=2 where id=1;
set global slow_query_log = on;
set global general_log = on;
commit;
create table t11(id int);
select * from mysql.slow_log;
start_time	user_host	query_time	lock_time	rows_sent	rows_examined	db	last_insert_id	insert_id	server_id	sql_text	thread_id	rows_affected
TIMESTAMP	USER_HOST	QUERY_TIME	LOCK_TIME	0	0	slow_log_sequoiadb	0	0	10	set global slow_query_log = on	THREAD_ID	ROWS_AFFECTED
TIMESTAMP	USER_HOST	QUERY_TIME	LOCK_TIME	0	0	slow_log_sequoiadb	0	0	10	set global general_log = on	THREAD_ID	ROWS_AFFECTED
TIMESTAMP	USER_HOST	QUERY_TIME	LOCK_TIME	0	0	slow_log_sequoiadb	0	0	10	commit	THREAD_ID	ROWS_AFFECTED
TIMESTAMP	USER_HOST	QUERY_TIME	LOCK_TIME	0	0	slow_log_sequoiadb	0	0	10	create table t11(id int)	THREAD_ID	ROWS_AFFECTED
select * from mysql.general_log;
event_time	user_host	thread_id	server_id	command_type	argument
TIMESTAMP	USER_HOST	THREAD_ID	10	Query	commit
TIMESTAMP	USER_HOST	THREAD_ID	10	Query	create table t11(id int)
TIMESTAMP	USER_HOST	THREAD_ID	10	Query	select * from mysql.slow_log
TIMESTAMP	USER_HOST	THREAD_ID	10	Query	select * from mysql.general_log
set global slow_query_log = off;
set global general_log = off;
use mysql;
drop table slow_log, general_log;
CREATE TABLE `slow_log` (
`start_time` timestamp(6) NOT NULL DEFAULT current_timestamp(6) ON UPDATE current_timestamp(6),
`user_host` mediumtext NOT NULL,
`query_time` time(6) NOT NULL,
`lock_time` time(6) NOT NULL,
`rows_sent` int(11) NOT NULL,
`rows_examined` int(11) NOT NULL,
`db` varchar(512) NOT NULL,
`last_insert_id` int(11) NOT NULL,
`insert_id` int(11) NOT NULL,
`server_id` int(10) unsigned NOT NULL,
`sql_text` mediumtext NOT NULL,
`thread_id` bigint(21) unsigned NOT NULL,
`rows_affected` int(11) NOT NULL
) ENGINE=SequoiaDB DEFAULT CHARSET=utf8 COMMENT='Slow log,sequoiadb:{table_options: {NoTrans:true}}';
CREATE TABLE `general_log` (
`event_time` timestamp(6) NOT NULL DEFAULT current_timestamp(6) ON UPDATE current_timestamp(6),
`user_host` mediumtext NOT NULL,
`thread_id` bigint(21) unsigned NOT NULL,
`server_id` int(10) unsigned NOT NULL,
`command_type` varchar(64) NOT NULL,
`argument` mediumtext NOT NULL
) ENGINE=SequoiaDB DEFAULT CHARSET=utf8 COMMENT='General log,sequoiadb:{table_options: {NoTrans:true}}';
use slow_log_sequoiadb;
create procedure select1()
begin
select count(*) from t10;
end &&
set global slow_query_log = on;
set global general_log = on;
create table t12(id int);
call select1();
count(*)
1
select * from mysql.slow_log;
start_time	user_host	query_time	lock_time	rows_sent	rows_examined	db	last_insert_id	insert_id	server_id	sql_text	thread_id	rows_affected
TIMESTAMP	USER_HOST	QUERY_TIME	LOCK_TIME	0	0	slow_log_sequoiadb	0	0	10	set global slow_query_log = on	THREAD_ID	ROWS_AFFECTED
TIMESTAMP	USER_HOST	QUERY_TIME	LOCK_TIME	0	0	slow_log_sequoiadb	0	0	10	set global general_log = on	THREAD_ID	ROWS_AFFECTED
TIMESTAMP	USER_HOST	QUERY_TIME	LOCK_TIME	0	0	slow_log_sequoiadb	0	0	10	create table t12(id int)	THREAD_ID	ROWS_AFFECTED
TIMESTAMP	USER_HOST	QUERY_TIME	LOCK_TIME	1	0	slow_log_sequoiadb	0	0	10	call select1()	THREAD_ID	ROWS_AFFECTED
select * from mysql.general_log;
event_time	user_host	thread_id	server_id	command_type	argument
TIMESTAMP	USER_HOST	THREAD_ID	10	Query	create table t12(id int)
TIMESTAMP	USER_HOST	THREAD_ID	10	Query	call select1()
TIMESTAMP	USER_HOST	THREAD_ID	10	Query	select * from mysql.slow_log
TIMESTAMP	USER_HOST	THREAD_ID	10	Query	select * from mysql.general_log
set global slow_query_log = off;
set global general_log = off;
use mysql;
drop table slow_log, general_log;
CREATE TABLE `slow_log` (
`start_time` timestamp(6) NOT NULL DEFAULT current_timestamp(6) ON UPDATE current_timestamp(6),
`user_host` mediumtext NOT NULL,
`query_time` time(6) NOT NULL,
`lock_time` time(6) NOT NULL,
`rows_sent` int(11) NOT NULL,
`rows_examined` int(11) NOT NULL,
`db` varchar(512) NOT NULL,
`last_insert_id` int(11) NOT NULL,
`insert_id` int(11) NOT NULL,
`server_id` int(10) unsigned NOT NULL,
`sql_text` mediumtext NOT NULL,
`thread_id` bigint(21) unsigned NOT NULL,
`rows_affected` int(11) NOT NULL
) ENGINE=SequoiaDB DEFAULT CHARSET=utf8 COMMENT='Slow log,sequoiadb:{table_options: {NoTrans:true}}';
CREATE TABLE `general_log` (
`event_time` timestamp(6) NOT NULL DEFAULT current_timestamp(6) ON UPDATE current_timestamp(6),
`user_host` mediumtext NOT NULL,
`thread_id` bigint(21) unsigned NOT NULL,
`server_id` int(10) unsigned NOT NULL,
`command_type` varchar(64) NOT NULL,
`argument` mediumtext NOT NULL
) ENGINE=SequoiaDB DEFAULT CHARSET=utf8 COMMENT='General log,sequoiadb:{table_options: {NoTrans:true}}';
use slow_log_sequoiadb;
set global slow_query_log = on;
set global general_log = on;
create procedure select2()
begin
declare i int;
set i = 0;
while i < 5 do
set i = i + 1;
select count(*) from t10;
end while;
end &&
create table t13(id int);
call select2();
count(*)
1
count(*)
1
count(*)
1
count(*)
1
count(*)
1
select * from mysql.slow_log;
start_time	user_host	query_time	lock_time	rows_sent	rows_examined	db	last_insert_id	insert_id	server_id	sql_text	thread_id	rows_affected
TIMESTAMP	USER_HOST	QUERY_TIME	LOCK_TIME	0	0	slow_log_sequoiadb	0	0	10	set global slow_query_log = on	THREAD_ID	ROWS_AFFECTED
TIMESTAMP	USER_HOST	QUERY_TIME	LOCK_TIME	0	0	slow_log_sequoiadb	0	0	10	set global general_log = on	THREAD_ID	ROWS_AFFECTED
TIMESTAMP	USER_HOST	QUERY_TIME	LOCK_TIME	0	0	slow_log_sequoiadb	0	0	10	create procedure select2()
begin
declare i int;
set i = 0;
while i < 5 do
set i = i + 1;
select count(*) from t10;
end while;
end	THREAD_ID	ROWS_AFFECTED
TIMESTAMP	USER_HOST	QUERY_TIME	LOCK_TIME	0	0	slow_log_sequoiadb	0	0	10	create table t13(id int)	THREAD_ID	ROWS_AFFECTED
TIMESTAMP	USER_HOST	QUERY_TIME	LOCK_TIME	5	0	slow_log_sequoiadb	0	0	10	call select2()	THREAD_ID	ROWS_AFFECTED
select * from mysql.general_log;
event_time	user_host	thread_id	server_id	command_type	argument
TIMESTAMP	USER_HOST	THREAD_ID	10	Query	create procedure select2()
begin
declare i int;
set i = 0;
while i < 5 do
set i = i + 1;
select count(*) from t10;
end while;
end
TIMESTAMP	USER_HOST	THREAD_ID	10	Query	create table t13(id int)
TIMESTAMP	USER_HOST	THREAD_ID	10	Query	call select2()
TIMESTAMP	USER_HOST	THREAD_ID	10	Query	select * from mysql.slow_log
TIMESTAMP	USER_HOST	THREAD_ID	10	Query	select * from mysql.general_log
set global slow_query_log = off;
set global general_log = off;
use mysql;
drop table slow_log, general_log;
CREATE TABLE `slow_log` (
`start_time` timestamp(6) NOT NULL DEFAULT current_timestamp(6) ON UPDATE current_timestamp(6),
`user_host` mediumtext NOT NULL,
`query_time` time(6) NOT NULL,
`lock_time` time(6) NOT NULL,
`rows_sent` int(11) NOT NULL,
`rows_examined` int(11) NOT NULL,
`db` varchar(512) NOT NULL,
`last_insert_id` int(11) NOT NULL,
`insert_id` int(11) NOT NULL,
`server_id` int(10) unsigned NOT NULL,
`sql_text` mediumtext NOT NULL,
`thread_id` bigint(21) unsigned NOT NULL,
`rows_affected` int(11) NOT NULL
) ENGINE=SequoiaDB DEFAULT CHARSET=utf8 COMMENT='Slow log,sequoiadb:{table_options: {NoTrans:true}}';
CREATE TABLE `general_log` (
`event_time` timestamp(6) NOT NULL DEFAULT current_timestamp(6) ON UPDATE current_timestamp(6),
`user_host` mediumtext NOT NULL,
`thread_id` bigint(21) unsigned NOT NULL,
`server_id` int(10) unsigned NOT NULL,
`command_type` varchar(64) NOT NULL,
`argument` mediumtext NOT NULL
) ENGINE=SequoiaDB DEFAULT CHARSET=utf8 COMMENT='General log,sequoiadb:{table_options: {NoTrans:true}}';
use slow_log_sequoiadb;
set global slow_query_log = on;
set global general_log = on;
create table t14(id int);
create procedure select3()
begin
declare i int;
set i = 0;
while i < 5 do
set i = i + 1;
select count(*) from t14;
end while;
end &&
begin;
insert into t14(id) values(1);
update t14 set id=2 where id=1;
call select3();
count(*)
1
count(*)
1
count(*)
1
count(*)
1
count(*)
1
commit;
select * from mysql.slow_log;
start_time	user_host	query_time	lock_time	rows_sent	rows_examined	db	last_insert_id	insert_id	server_id	sql_text	thread_id	rows_affected
TIMESTAMP	USER_HOST	QUERY_TIME	LOCK_TIME	0	0	slow_log_sequoiadb	0	0	10	set global slow_query_log = on	THREAD_ID	ROWS_AFFECTED
TIMESTAMP	USER_HOST	QUERY_TIME	LOCK_TIME	0	0	slow_log_sequoiadb	0	0	10	set global general_log = on	THREAD_ID	ROWS_AFFECTED
TIMESTAMP	USER_HOST	QUERY_TIME	LOCK_TIME	0	0	slow_log_sequoiadb	0	0	10	create table t14(id int)	THREAD_ID	ROWS_AFFECTED
TIMESTAMP	USER_HOST	QUERY_TIME	LOCK_TIME	0	0	slow_log_sequoiadb	0	0	10	create procedure select3()
begin
declare i int;
set i = 0;
while i < 5 do
set i = i + 1;
select count(*) from t14;
end while;
end	THREAD_ID	ROWS_AFFECTED
TIMESTAMP	USER_HOST	QUERY_TIME	LOCK_TIME	0	0	slow_log_sequoiadb	0	0	10	begin	THREAD_ID	ROWS_AFFECTED
TIMESTAMP	USER_HOST	QUERY_TIME	LOCK_TIME	0	0	slow_log_sequoiadb	0	0	10	insert into t14(id) values(1)	THREAD_ID	ROWS_AFFECTED
TIMESTAMP	USER_HOST	QUERY_TIME	LOCK_TIME	0	0	slow_log_sequoiadb	0	0	10	update t14 set id=2 where id=1	THREAD_ID	ROWS_AFFECTED
TIMESTAMP	USER_HOST	QUERY_TIME	LOCK_TIME	5	0	slow_log_sequoiadb	0	0	10	call select3()	THREAD_ID	ROWS_AFFECTED
TIMESTAMP	USER_HOST	QUERY_TIME	LOCK_TIME	0	0	slow_log_sequoiadb	0	0	10	commit	THREAD_ID	ROWS_AFFECTED
select * from mysql.general_log;
event_time	user_host	thread_id	server_id	command_type	argument
TIMESTAMP	USER_HOST	THREAD_ID	10	Query	create table t14(id int)
TIMESTAMP	USER_HOST	THREAD_ID	10	Query	create procedure select3()
begin
declare i int;
set i = 0;
while i < 5 do
set i = i + 1;
select count(*) from t14;
end while;
end
TIMESTAMP	USER_HOST	THREAD_ID	10	Query	begin
TIMESTAMP	USER_HOST	THREAD_ID	10	Query	insert into t14(id) values(1)
TIMESTAMP	USER_HOST	THREAD_ID	10	Query	update t14 set id=2 where id=1
TIMESTAMP	USER_HOST	THREAD_ID	10	Query	call select3()
TIMESTAMP	USER_HOST	THREAD_ID	10	Query	commit
TIMESTAMP	USER_HOST	THREAD_ID	10	Query	select * from mysql.slow_log
TIMESTAMP	USER_HOST	THREAD_ID	10	Query	select * from mysql.general_log
begin;
insert into t14(id) values(3);
update t14 set id=4 where id=3;
call select3();
count(*)
2
count(*)
2
count(*)
2
count(*)
2
count(*)
2
commit;
select * from mysql.slow_log;
start_time	user_host	query_time	lock_time	rows_sent	rows_examined	db	last_insert_id	insert_id	server_id	sql_text	thread_id	rows_affected
TIMESTAMP	USER_HOST	QUERY_TIME	LOCK_TIME	0	0	slow_log_sequoiadb	0	0	10	set global slow_query_log = on	THREAD_ID	ROWS_AFFECTED
TIMESTAMP	USER_HOST	QUERY_TIME	LOCK_TIME	0	0	slow_log_sequoiadb	0	0	10	set global general_log = on	THREAD_ID	ROWS_AFFECTED
TIMESTAMP	USER_HOST	QUERY_TIME	LOCK_TIME	0	0	slow_log_sequoiadb	0	0	10	create table t14(id int)	THREAD_ID	ROWS_AFFECTED
TIMESTAMP	USER_HOST	QUERY_TIME	LOCK_TIME	0	0	slow_log_sequoiadb	0	0	10	create procedure select3()
begin
declare i int;
set i = 0;
while i < 5 do
set i = i + 1;
select count(*) from t14;
end while;
end	THREAD_ID	ROWS_AFFECTED
TIMESTAMP	USER_HOST	QUERY_TIME	LOCK_TIME	0	0	slow_log_sequoiadb	0	0	10	begin	THREAD_ID	ROWS_AFFECTED
TIMESTAMP	USER_HOST	QUERY_TIME	LOCK_TIME	0	0	slow_log_sequoiadb	0	0	10	insert into t14(id) values(1)	THREAD_ID	ROWS_AFFECTED
TIMESTAMP	USER_HOST	QUERY_TIME	LOCK_TIME	0	0	slow_log_sequoiadb	0	0	10	update t14 set id=2 where id=1	THREAD_ID	ROWS_AFFECTED
TIMESTAMP	USER_HOST	QUERY_TIME	LOCK_TIME	5	0	slow_log_sequoiadb	0	0	10	call select3()	THREAD_ID	ROWS_AFFECTED
TIMESTAMP	USER_HOST	QUERY_TIME	LOCK_TIME	0	0	slow_log_sequoiadb	0	0	10	commit	THREAD_ID	ROWS_AFFECTED
TIMESTAMP	USER_HOST	QUERY_TIME	LOCK_TIME	9	9	slow_log_sequoiadb	0	0	10	select * from mysql.slow_log	THREAD_ID	ROWS_AFFECTED
TIMESTAMP	USER_HOST	QUERY_TIME	LOCK_TIME	9	9	slow_log_sequoiadb	0	0	10	select * from mysql.general_log	THREAD_ID	ROWS_AFFECTED
TIMESTAMP	USER_HOST	QUERY_TIME	LOCK_TIME	0	0	slow_log_sequoiadb	0	0	10	begin	THREAD_ID	ROWS_AFFECTED
TIMESTAMP	USER_HOST	QUERY_TIME	LOCK_TIME	0	0	slow_log_sequoiadb	0	0	10	insert into t14(id) values(3)	THREAD_ID	ROWS_AFFECTED
TIMESTAMP	USER_HOST	QUERY_TIME	LOCK_TIME	0	0	slow_log_sequoiadb	0	0	10	update t14 set id=4 where id=3	THREAD_ID	ROWS_AFFECTED
TIMESTAMP	USER_HOST	QUERY_TIME	LOCK_TIME	5	0	slow_log_sequoiadb	0	0	10	call select3()	THREAD_ID	ROWS_AFFECTED
TIMESTAMP	USER_HOST	QUERY_TIME	LOCK_TIME	0	0	slow_log_sequoiadb	0	0	10	commit	THREAD_ID	ROWS_AFFECTED
select * from mysql.general_log;
event_time	user_host	thread_id	server_id	command_type	argument
TIMESTAMP	USER_HOST	THREAD_ID	10	Query	create table t14(id int)
TIMESTAMP	USER_HOST	THREAD_ID	10	Query	create procedure select3()
begin
declare i int;
set i = 0;
while i < 5 do
set i = i + 1;
select count(*) from t14;
end while;
end
TIMESTAMP	USER_HOST	THREAD_ID	10	Query	begin
TIMESTAMP	USER_HOST	THREAD_ID	10	Query	insert into t14(id) values(1)
TIMESTAMP	USER_HOST	THREAD_ID	10	Query	update t14 set id=2 where id=1
TIMESTAMP	USER_HOST	THREAD_ID	10	Query	call select3()
TIMESTAMP	USER_HOST	THREAD_ID	10	Query	commit
TIMESTAMP	USER_HOST	THREAD_ID	10	Query	select * from mysql.slow_log
TIMESTAMP	USER_HOST	THREAD_ID	10	Query	select * from mysql.general_log
TIMESTAMP	USER_HOST	THREAD_ID	10	Query	begin
TIMESTAMP	USER_HOST	THREAD_ID	10	Query	insert into t14(id) values(3)
TIMESTAMP	USER_HOST	THREAD_ID	10	Query	update t14 set id=4 where id=3
TIMESTAMP	USER_HOST	THREAD_ID	10	Query	call select3()
TIMESTAMP	USER_HOST	THREAD_ID	10	Query	commit
TIMESTAMP	USER_HOST	THREAD_ID	10	Query	select * from mysql.slow_log
TIMESTAMP	USER_HOST	THREAD_ID	10	Query	select * from mysql.general_log
set global slow_query_log = off;
set global general_log = off;
use mysql;
delete from slow_log;
ERROR HY000: You can't use locks with log tables
delete from general_log;
ERROR HY000: You can't use locks with log tables
set global slow_query_log = off;
set global general_log = off;
use mysql;
drop table slow_log, general_log;
CREATE TABLE `slow_log` (
`start_time` timestamp(6) NOT NULL DEFAULT current_timestamp(6) ON UPDATE current_timestamp(6),
`user_host` mediumtext NOT NULL,
`query_time` time(6) NOT NULL,
`lock_time` time(6) NOT NULL,
`rows_sent` int(11) NOT NULL,
`rows_examined` int(11) NOT NULL,
`db` varchar(512) NOT NULL,
`last_insert_id` int(11) NOT NULL,
`insert_id` int(11) NOT NULL,
`server_id` int(10) unsigned NOT NULL,
`sql_text` mediumtext NOT NULL,
`thread_id` bigint(21) unsigned NOT NULL,
`rows_affected` int(11) NOT NULL
) ENGINE=SequoiaDB DEFAULT CHARSET=utf8 COMMENT='Slow log,sequoiadb:{table_options: {NoTrans:true}}';
CREATE TABLE `general_log` (
`event_time` timestamp(6) NOT NULL DEFAULT current_timestamp(6) ON UPDATE current_timestamp(6),
`user_host` mediumtext NOT NULL,
`thread_id` bigint(21) unsigned NOT NULL,
`server_id` int(10) unsigned NOT NULL,
`command_type` varchar(64) NOT NULL,
`argument` mediumtext NOT NULL
) ENGINE=SequoiaDB DEFAULT CHARSET=utf8 COMMENT='General log,sequoiadb:{table_options: {NoTrans:true}}';
use slow_log_sequoiadb;
create table t15(id int);
insert into t15 values (1),(2);
use mysql;
set global slow_query_log = on;
set global general_log = on;
select * from slow_log_sequoiadb.t15;
id
1
2
select count(*) from slow_log;
count(*)
COUNT
select count(*) from general_log;
count(*)
COUNT
update slow_log set rows_sent = 1 where rows_examined = 1;
ERROR HY000: You can't use locks with log tables
update general_log set thread_id = 1 where command_type = 'Query';
ERROR HY000: You can't use locks with log tables
delete from slow_log where rows_examined = 1;
ERROR HY000: You can't use locks with log tables
delete from general_log where command_type = 'Query';
ERROR HY000: You can't use locks with log tables
insert into slow_log select * from slow_log;
ERROR HY000: You can't use locks with log tables
insert into general_log select * from general_log;
ERROR HY000: You can't use locks with log tables
select * from slow_log;
start_time	user_host	query_time	lock_time	rows_sent	rows_examined	db	last_insert_id	insert_id	server_id	sql_text	thread_id	rows_affected
TIMESTAMP	USER_HOST	QUERY_TIME	LOCK_TIME	0	0	mysql	0	0	10	set global slow_query_log = on	THREAD_ID	ROWS_AFFECTED
TIMESTAMP	USER_HOST	QUERY_TIME	LOCK_TIME	0	0	mysql	0	0	10	set global general_log = on	THREAD_ID	ROWS_AFFECTED
TIMESTAMP	USER_HOST	QUERY_TIME	LOCK_TIME	2	2	mysql	0	0	10	select * from slow_log_sequoiadb.t15	THREAD_ID	ROWS_AFFECTED
TIMESTAMP	USER_HOST	QUERY_TIME	LOCK_TIME	1	0	mysql	0	0	10	select count(*) from slow_log	THREAD_ID	ROWS_AFFECTED
TIMESTAMP	USER_HOST	QUERY_TIME	LOCK_TIME	1	0	mysql	0	0	10	select count(*) from general_log	THREAD_ID	ROWS_AFFECTED
TIMESTAMP	USER_HOST	QUERY_TIME	LOCK_TIME	0	0	mysql	0	0	10	update slow_log set rows_sent = 1 where rows_examined = 1	THREAD_ID	ROWS_AFFECTED
TIMESTAMP	USER_HOST	QUERY_TIME	LOCK_TIME	0	0	mysql	0	0	10	update general_log set thread_id = 1 where command_type = 'Query'	THREAD_ID	ROWS_AFFECTED
TIMESTAMP	USER_HOST	QUERY_TIME	LOCK_TIME	0	0	mysql	0	0	10	delete from slow_log where rows_examined = 1	THREAD_ID	ROWS_AFFECTED
TIMESTAMP	USER_HOST	QUERY_TIME	LOCK_TIME	0	0	mysql	0	0	10	delete from general_log where command_type = 'Query'	THREAD_ID	ROWS_AFFECTED
TIMESTAMP	USER_HOST	QUERY_TIME	LOCK_TIME	0	0	mysql	0	0	10	insert into slow_log select * from slow_log	THREAD_ID	ROWS_AFFECTED
TIMESTAMP	USER_HOST	QUERY_TIME	LOCK_TIME	0	0	mysql	0	0	10	insert into general_log select * from general_log	THREAD_ID	ROWS_AFFECTED
select * from general_log;
event_time	user_host	thread_id	server_id	command_type	argument
TIMESTAMP	USER_HOST	THREAD_ID	10	Query	select * from slow_log_sequoiadb.t15
TIMESTAMP	USER_HOST	THREAD_ID	10	Query	select count(*) from slow_log
TIMESTAMP	USER_HOST	THREAD_ID	10	Query	select count(*) from general_log
TIMESTAMP	USER_HOST	THREAD_ID	10	Query	update slow_log set rows_sent = 1 where rows_examined = 1
TIMESTAMP	USER_HOST	THREAD_ID	10	Query	update general_log set thread_id = 1 where command_type = 'Query'
TIMESTAMP	USER_HOST	THREAD_ID	10	Query	delete from slow_log where rows_examined = 1
TIMESTAMP	USER_HOST	THREAD_ID	10	Query	delete from general_log where command_type = 'Query'
TIMESTAMP	USER_HOST	THREAD_ID	10	Query	insert into slow_log select * from slow_log
TIMESTAMP	USER_HOST	THREAD_ID	10	Query	insert into general_log select * from general_log
TIMESTAMP	USER_HOST	THREAD_ID	10	Query	select * from slow_log
TIMESTAMP	USER_HOST	THREAD_ID	10	Query	select * from general_log
truncate mysql.slow_log;
truncate mysql.general_log;
set global server_id = 1;
set global log_output = 'FILE';
set global sequoiadb_error_level = 'error';
set global slow_query_log = 1;
set global general_log = 1;
drop database slow_log_sequoiadb;
