SET sequoiadb_execute_only_in_mysql = ON;
CREATE TABLE t1 ( a INT, c CHAR(16), PRIMARY KEY(a,c) )
PARTITION BY RANGE COLUMNS (a,c) (
PARTITION p1 VALUES LESS THAN (10,'h'),
PARTITION p2 VALUES LESS THAN (20,'m'),
PARTITION p3 VALUES LESS THAN (50,'z')
);
SHOW CREATE TABLE t1;
Table	Create Table
t1	CREATE TABLE `t1` (
  `a` int(11) NOT NULL,
  `c` char(16) NOT NULL,
  PRIMARY KEY (`a`,`c`)
) ENGINE=SequoiaDB DEFAULT CHARSET=latin1 COLLATE=latin1_swedish_ci
 PARTITION BY RANGE  COLUMNS(`a`,`c`)
(PARTITION `p1` VALUES LESS THAN (10,'h') ENGINE = SequoiaDB,
 PARTITION `p2` VALUES LESS THAN (20,'m') ENGINE = SequoiaDB,
 PARTITION `p3` VALUES LESS THAN (50,'z') ENGINE = SequoiaDB)
INSERT INTO t1 PARTITION (p2,p3) VALUES (20,'m'),(22,'j'),(25,'n'),(30,'o'),(40,'t'),(49,'z');
SELECT * FROM t1 ORDER BY a;
a	c
DROP TABLE t1;
SET sequoiadb_execute_only_in_mysql = OFF;
CREATE TABLE `t1#ExecuteOnly#List#Expr` ( id INT, a INT NOT NULL, b INT GENERATED ALWAYS AS (a+1) STORED )
PARTITION BY LIST (b) (
PARTITION ptest1 VALUES IN (-4,40,9,-1,0,100,11),
PARTITION otest2 VALUES IN (3,50,8,-9,41,99,1),
PARTITION qtest3 VALUES IN (36,7,-8,-50,14,13),
PARTITION ytest4 VALUES IN (6,16,-7,12,-13,10,101,-99)
);
SHOW CREATE TABLE `t1#ExecuteOnly#List#Expr`;
Table	Create Table
t1#ExecuteOnly#List#Expr	CREATE TABLE `t1#ExecuteOnly#List#Expr` (
  `id` int(11) DEFAULT NULL,
  `a` int(11) NOT NULL,
  `b` int(11) GENERATED ALWAYS AS (`a` + 1) STORED
) ENGINE=SequoiaDB DEFAULT CHARSET=latin1 COLLATE=latin1_swedish_ci
 PARTITION BY LIST (`b`)
(PARTITION `ptest1` VALUES IN (-4,40,9,-1,0,100,11) ENGINE = SequoiaDB,
 PARTITION `otest2` VALUES IN (3,50,8,-9,41,99,1) ENGINE = SequoiaDB,
 PARTITION `qtest3` VALUES IN (36,7,-8,-50,14,13) ENGINE = SequoiaDB,
 PARTITION `ytest4` VALUES IN (6,16,-7,12,-13,10,101,-99) ENGINE = SequoiaDB)
INSERT INTO `t1#ExecuteOnly#List#Expr` PARTITION (otest2,qtest3,ytest4)(id,a) VALUES (0,0),(40,40),(11,11),(13,13),(12,12),(-8,-8),(100,100),(9,9),(2,2);
SET sequoiadb_execute_only_in_mysql = ON;
UPDATE `t1#ExecuteOnly#List#Expr` PARTITION (ptest1,otest2,ytest4) SET id = id*2 WHERE a >= 10;
SELECT * FROM `t1#ExecuteOnly#List#Expr` PARTITION (otest2,qtest3,ytest4) WHERE a IN (2,99,11) ORDER BY id;
id	a	b
ALTER TABLE `t1#ExecuteOnly#List#Expr` ADD UNIQUE KEY (b);
SHOW CREATE TABLE `t1#ExecuteOnly#List#Expr`;
Table	Create Table
t1#ExecuteOnly#List#Expr	CREATE TABLE `t1#ExecuteOnly#List#Expr` (
  `id` int(11) DEFAULT NULL,
  `a` int(11) NOT NULL,
  `b` int(11) GENERATED ALWAYS AS (`a` + 1) STORED,
  UNIQUE KEY `b` (`b`)
) ENGINE=SequoiaDB DEFAULT CHARSET=latin1 COLLATE=latin1_swedish_ci
 PARTITION BY LIST (`b`)
(PARTITION `ptest1` VALUES IN (-4,40,9,-1,0,100,11) ENGINE = SequoiaDB,
 PARTITION `otest2` VALUES IN (3,50,8,-9,41,99,1) ENGINE = SequoiaDB,
 PARTITION `qtest3` VALUES IN (36,7,-8,-50,14,13) ENGINE = SequoiaDB,
 PARTITION `ytest4` VALUES IN (6,16,-7,12,-13,10,101,-99) ENGINE = SequoiaDB)
SELECT * FROM `t1#ExecuteOnly#List#Expr` PARTITION (otest2,qtest3,ytest4) WHERE a IN (2,99,11) ORDER BY id;
id	a	b
DELETE FROM `t1#ExecuteOnly#List#Expr` PARTITION (ptest1,otest2,qtest3) WHERE a IN (10,13,90,95,0);
SELECT * FROM `t1#ExecuteOnly#List#Expr` PARTITION (ptest1,otest2,qtest3,ytest4) ORDER BY id;
id	a	b
FLUSH TABLE `t1#ExecuteOnly#List#Expr`;
SELECT PARTITION_NAME, PARTITION_METHOD, PARTITION_EXPRESSION, TABLE_ROWS 
FROM INFORMATION_SCHEMA.PARTITIONS WHERE TABLE_SCHEMA LIKE '%test_parallel%' AND TABLE_NAME = 't1#ExecuteOnly#List#Expr';
PARTITION_NAME	PARTITION_METHOD	PARTITION_EXPRESSION	TABLE_ROWS
ptest1	LIST	`b`	18446744073709551615
otest2	LIST	`b`	18446744073709551615
qtest3	LIST	`b`	18446744073709551615
ytest4	LIST	`b`	18446744073709551615
SET sequoiadb_execute_only_in_mysql = OFF;
SELECT * FROM `t1#ExecuteOnly#List#Expr` PARTITION (ptest1,otest2,qtest3,ytest4) ORDER BY id;
id	a	b
-8	-8	-7
0	0	1
2	2	3
9	9	10
11	11	12
12	12	13
13	13	14
40	40	41
100	100	101
FLUSH TABLE `t1#ExecuteOnly#List#Expr`;
SELECT PARTITION_NAME, PARTITION_METHOD, PARTITION_EXPRESSION, TABLE_ROWS
FROM INFORMATION_SCHEMA.PARTITIONS WHERE TABLE_SCHEMA LIKE '%test_parallel%' AND TABLE_NAME = 't1#ExecuteOnly#List#Expr';
PARTITION_NAME	PARTITION_METHOD	PARTITION_EXPRESSION	TABLE_ROWS
ptest1	LIST	`b`	3
otest2	LIST	`b`	2
qtest3	LIST	`b`	2
ytest4	LIST	`b`	2
SET sequoiadb_execute_only_in_mysql = ON;
ALTER TABLE `t1#ExecuteOnly#List#Expr` ADD PARTITION (
PARTITION pmore1 VALUES IN (-3,19,21,-2,97),
PARTITION pmore2 VALUES IN (32,28,15,4,-10)
);
SHOW CREATE TABLE `t1#ExecuteOnly#List#Expr`;
Table	Create Table
t1#ExecuteOnly#List#Expr	CREATE TABLE `t1#ExecuteOnly#List#Expr` (
  `id` int(11) DEFAULT NULL,
  `a` int(11) NOT NULL,
  `b` int(11) GENERATED ALWAYS AS (`a` + 1) STORED,
  UNIQUE KEY `b` (`b`)
) ENGINE=SequoiaDB DEFAULT CHARSET=latin1 COLLATE=latin1_swedish_ci
 PARTITION BY LIST (`b`)
(PARTITION `ptest1` VALUES IN (-4,40,9,-1,0,100,11) ENGINE = SequoiaDB,
 PARTITION `otest2` VALUES IN (3,50,8,-9,41,99,1) ENGINE = SequoiaDB,
 PARTITION `qtest3` VALUES IN (36,7,-8,-50,14,13) ENGINE = SequoiaDB,
 PARTITION `ytest4` VALUES IN (6,16,-7,12,-13,10,101,-99) ENGINE = SequoiaDB,
 PARTITION `pmore1` VALUES IN (-3,19,21,-2,97) ENGINE = SequoiaDB,
 PARTITION `pmore2` VALUES IN (32,28,15,4,-10) ENGINE = SequoiaDB)
INSERT INTO `t1#ExecuteOnly#List#Expr` PARTITION (pmore1,pmore2)(id,a) VALUES (-4,-4),(31,31),(-3,-3),(3,3);
ALTER TABLE `t1#ExecuteOnly#List#Expr` REORGANIZE PARTITION otest2,qtest3 INTO (
PARTITION qtest3 VALUES IN (35,27,-22,-6,26,88)
);
ALTER TABLE `t1#ExecuteOnly#List#Expr` REORGANIZE PARTITION pmore1 INTO (
PARTITION pmoren1 VALUES IN (38,5,17),
PARTITION pmoren2 VALUES IN (30,-5,13),
PARTITION pmoren3 VALUES IN (-30,29,18)
);
SHOW CREATE TABLE `t1#ExecuteOnly#List#Expr`;
Table	Create Table
t1#ExecuteOnly#List#Expr	CREATE TABLE `t1#ExecuteOnly#List#Expr` (
  `id` int(11) DEFAULT NULL,
  `a` int(11) NOT NULL,
  `b` int(11) GENERATED ALWAYS AS (`a` + 1) STORED,
  UNIQUE KEY `b` (`b`)
) ENGINE=SequoiaDB DEFAULT CHARSET=latin1 COLLATE=latin1_swedish_ci
 PARTITION BY LIST (`b`)
(PARTITION `ptest1` VALUES IN (-4,40,9,-1,0,100,11) ENGINE = SequoiaDB,
 PARTITION `qtest3` VALUES IN (35,27,-22,-6,26,88) ENGINE = SequoiaDB,
 PARTITION `ytest4` VALUES IN (6,16,-7,12,-13,10,101,-99) ENGINE = SequoiaDB,
 PARTITION `pmoren1` VALUES IN (38,5,17) ENGINE = SequoiaDB,
 PARTITION `pmoren2` VALUES IN (30,-5,13) ENGINE = SequoiaDB,
 PARTITION `pmoren3` VALUES IN (-30,29,18) ENGINE = SequoiaDB,
 PARTITION `pmore2` VALUES IN (32,28,15,4,-10) ENGINE = SequoiaDB)
INSERT INTO `t1#ExecuteOnly#List#Expr` PARTITION (qtest3,pmoren1,pmoren2,pmoren3)(id,a) VALUES (-7,-7),(-23,-23),(-6,-6),(4,4),(17,17),(12,12),(16,16);
SELECT * FROM `t1#ExecuteOnly#List#Expr` PARTITION (qtest3,pmoren1,pmoren3) ORDER BY id;
id	a	b
ALTER TABLE `t1#ExecuteOnly#List#Expr` DROP PARTITION qtest3,ytest4,pmoren1,pmore2;
SHOW CREATE TABLE `t1#ExecuteOnly#List#Expr`;
Table	Create Table
t1#ExecuteOnly#List#Expr	CREATE TABLE `t1#ExecuteOnly#List#Expr` (
  `id` int(11) DEFAULT NULL,
  `a` int(11) NOT NULL,
  `b` int(11) GENERATED ALWAYS AS (`a` + 1) STORED,
  UNIQUE KEY `b` (`b`)
) ENGINE=SequoiaDB DEFAULT CHARSET=latin1 COLLATE=latin1_swedish_ci
 PARTITION BY LIST (`b`)
(PARTITION `ptest1` VALUES IN (-4,40,9,-1,0,100,11) ENGINE = SequoiaDB,
 PARTITION `pmoren2` VALUES IN (30,-5,13) ENGINE = SequoiaDB,
 PARTITION `pmoren3` VALUES IN (-30,29,18) ENGINE = SequoiaDB)
ALTER TABLE `t1#ExecuteOnly#List#Expr` REBUILD PARTITION ALL;
UPDATE `t1#ExecuteOnly#List#Expr` PARTITION (pmoren2,pmoren3) SET id = 1 WHERE a > 0;
SELECT * FROM `t1#ExecuteOnly#List#Expr` PARTITION (ptest1,pmoren2,pmoren3) ORDER BY id;
id	a	b
CREATE TABLE `t1#ExecuteOnly#List#Expr#P#ptest1` ( id INT, _phid_ BIGINT, a INT NOT NULL, b INT );
INSERT INTO `t1#ExecuteOnly#List#Expr#P#ptest1` VALUES (11,11,11,12),(17,17,17,18);
CHECK TABLE `t1#ExecuteOnly#List#Expr`;
Table	Op	Msg_type	Msg_text
x	check	status	OK
REPAIR TABLE `t1#ExecuteOnly#List#Expr`;
Table	Op	Msg_type	Msg_text
x	repair	status	OK
ALTER TABLE `t1#ExecuteOnly#List#Expr` CHECK PARTITION ptest1;
Table	Op	Msg_type	Msg_text
x	check	status	OK
ALTER TABLE `t1#ExecuteOnly#List#Expr` CHECK PARTITION ALL QUICK;
Table	Op	Msg_type	Msg_text
x	check	status	OK
ALTER TABLE `t1#ExecuteOnly#List#Expr` REPAIR PARTITION ptest1;
Table	Op	Msg_type	Msg_text
x	repair	status	OK
ALTER TABLE `t1#ExecuteOnly#List#Expr` REPAIR PARTITION ALL EXTENDED;
Table	Op	Msg_type	Msg_text
x	repair	status	OK
ALTER TABLE `t1#ExecuteOnly#List#Expr` TRUNCATE PARTITION ALL;
SELECT * FROM `t1#ExecuteOnly#List#Expr` PARTITION (ptest1,pmoren2,pmoren3) ORDER BY id;
id	a	b
FLUSH TABLE `t1#ExecuteOnly#List#Expr`;
SELECT PARTITION_NAME, PARTITION_METHOD, PARTITION_EXPRESSION, TABLE_ROWS
FROM INFORMATION_SCHEMA.PARTITIONS WHERE TABLE_SCHEMA LIKE '%test_parallel%' AND TABLE_NAME = 't1#ExecuteOnly#List#Expr';
PARTITION_NAME	PARTITION_METHOD	PARTITION_EXPRESSION	TABLE_ROWS
ptest1	LIST	`b`	18446744073709551615
pmoren2	LIST	`b`	18446744073709551615
pmoren3	LIST	`b`	18446744073709551615
SET sequoiadb_execute_only_in_mysql = OFF;
DROP TABLE `t1#ExecuteOnly#List#Expr`,`t1#ExecuteOnly#List#Expr#P#ptest1`;
SET sequoiadb_execute_only_in_mysql = ON;
CREATE TABLE `t1#ExecuteOnly#Hash` ( id FLOAT, b INT GENERATED ALWAYS AS (id+1) STORED )
PARTITION BY HASH( CEILING(b) ) PARTITIONS 16;
SHOW CREATE TABLE `t1#ExecuteOnly#Hash`;
Table	Create Table
t1#ExecuteOnly#Hash	CREATE TABLE `t1#ExecuteOnly#Hash` (
  `id` float DEFAULT NULL,
  `b` int(11) GENERATED ALWAYS AS (`id` + 1) STORED
) ENGINE=SequoiaDB DEFAULT CHARSET=latin1 COLLATE=latin1_swedish_ci
 PARTITION BY HASH (ceiling(`b`))
PARTITIONS 16
FLUSH TABLE `t1#ExecuteOnly#Hash`;
SELECT PARTITION_NAME, PARTITION_METHOD, PARTITION_EXPRESSION, TABLE_ROWS
FROM INFORMATION_SCHEMA.PARTITIONS WHERE TABLE_SCHEMA LIKE '%test_parallel%' AND TABLE_NAME = 't1#ExecuteOnly#Hash';
PARTITION_NAME	PARTITION_METHOD	PARTITION_EXPRESSION	TABLE_ROWS
p0	HASH	ceiling(`b`)	18446744073709551615
p1	HASH	ceiling(`b`)	18446744073709551615
p2	HASH	ceiling(`b`)	18446744073709551615
p3	HASH	ceiling(`b`)	18446744073709551615
p4	HASH	ceiling(`b`)	18446744073709551615
p5	HASH	ceiling(`b`)	18446744073709551615
p6	HASH	ceiling(`b`)	18446744073709551615
p7	HASH	ceiling(`b`)	18446744073709551615
p8	HASH	ceiling(`b`)	18446744073709551615
p9	HASH	ceiling(`b`)	18446744073709551615
p10	HASH	ceiling(`b`)	18446744073709551615
p11	HASH	ceiling(`b`)	18446744073709551615
p12	HASH	ceiling(`b`)	18446744073709551615
p13	HASH	ceiling(`b`)	18446744073709551615
p14	HASH	ceiling(`b`)	18446744073709551615
p15	HASH	ceiling(`b`)	18446744073709551615
INSERT INTO `t1#ExecuteOnly#Hash`(id) VALUES (1.19),(-2.94),(0.001),(123.45678901),(10.000011),(-5.667),(9.876),(-1.19);
SELECT * FROM `t1#ExecuteOnly#Hash` ORDER BY id;
id	b
INSERT INTO `t1#ExecuteOnly#Hash` PARTITION (p0)(id) VALUES (11.11);
ERROR 0A000: Cannot specify HASH or KEY partitions
SELECT * FROM `t1#ExecuteOnly#Hash` PARTITION (p0);
ERROR 0A000: Cannot specify HASH or KEY partitions
UPDATE `t1#ExecuteOnly#Hash` PARTITION (p1) SET id = 1 WHERE b > 10;
ERROR 0A000: Cannot specify HASH or KEY partitions
DELETE FROM `t1#ExecuteOnly#Hash` PARTITION (p3) WHERE id > 1;
ERROR 0A000: Cannot specify HASH or KEY partitions
ALTER TABLE `t1#ExecuteOnly#Hash` ADD PARTITION PARTITIONS 6;
SHOW CREATE TABLE `t1#ExecuteOnly#Hash`;
Table	Create Table
t1#ExecuteOnly#Hash	CREATE TABLE `t1#ExecuteOnly#Hash` (
  `id` float DEFAULT NULL,
  `b` int(11) GENERATED ALWAYS AS (`id` + 1) STORED
) ENGINE=SequoiaDB DEFAULT CHARSET=latin1 COLLATE=latin1_swedish_ci
 PARTITION BY HASH (ceiling(`b`))
PARTITIONS 22
ALTER TABLE `t1#ExecuteOnly#Hash` REBUILD PARTITION p15;
ERROR 0A000: Cannot specify HASH or KEY partitions
INSERT INTO `t1#ExecuteOnly#Hash`(id) VALUES (5.56),(-9.94);
SELECT * FROM `t1#ExecuteOnly#Hash` ORDER BY id;
id	b
CHECK TABLE `t1#ExecuteOnly#Hash`;
Table	Op	Msg_type	Msg_text
x	check	status	OK
REPAIR TABLE `t1#ExecuteOnly#Hash`;
Table	Op	Msg_type	Msg_text
x	repair	status	OK
ALTER TABLE `t1#ExecuteOnly#Hash` TRUNCATE PARTITION ALL;
SELECT * FROM `t1#ExecuteOnly#Hash` ORDER BY id;
id	b
FLUSH TABLE `t1#ExecuteOnly#Hash`;
SELECT PARTITION_NAME, PARTITION_METHOD, PARTITION_EXPRESSION, TABLE_ROWS
FROM INFORMATION_SCHEMA.PARTITIONS WHERE TABLE_SCHEMA LIKE '%test_parallel%' AND TABLE_NAME = 't1#ExecuteOnly#Hash';
PARTITION_NAME	PARTITION_METHOD	PARTITION_EXPRESSION	TABLE_ROWS
p0	HASH	ceiling(`b`)	18446744073709551615
p1	HASH	ceiling(`b`)	18446744073709551615
p2	HASH	ceiling(`b`)	18446744073709551615
p3	HASH	ceiling(`b`)	18446744073709551615
p4	HASH	ceiling(`b`)	18446744073709551615
p5	HASH	ceiling(`b`)	18446744073709551615
p6	HASH	ceiling(`b`)	18446744073709551615
p7	HASH	ceiling(`b`)	18446744073709551615
p8	HASH	ceiling(`b`)	18446744073709551615
p9	HASH	ceiling(`b`)	18446744073709551615
p10	HASH	ceiling(`b`)	18446744073709551615
p11	HASH	ceiling(`b`)	18446744073709551615
p12	HASH	ceiling(`b`)	18446744073709551615
p13	HASH	ceiling(`b`)	18446744073709551615
p14	HASH	ceiling(`b`)	18446744073709551615
p15	HASH	ceiling(`b`)	18446744073709551615
p16	HASH	ceiling(`b`)	18446744073709551615
p17	HASH	ceiling(`b`)	18446744073709551615
p18	HASH	ceiling(`b`)	18446744073709551615
p19	HASH	ceiling(`b`)	18446744073709551615
p20	HASH	ceiling(`b`)	18446744073709551615
p21	HASH	ceiling(`b`)	18446744073709551615
DROP TABLE `t1#ExecuteOnly#Hash`;
CREATE TABLE t1(id int, a int) COMMENT 'sequoiadb:{ partition_options: { ShardingKey: {a:1} } }'
PARTITION BY LIST ( id ) (
PARTITION p0 VALUES IN (1,3,5),
PARTITION p1 VALUES IN (2,4,8),
PARTITION p2 VALUES IN (6,10),
PARTITION p3 VALUES IN (7,9)
);
SHOW CREATE TABLE t1;
Table	Create Table
t1	CREATE TABLE `t1` (
  `id` int(11) DEFAULT NULL,
  `a` int(11) DEFAULT NULL
) ENGINE=SequoiaDB DEFAULT CHARSET=latin1 COLLATE=latin1_swedish_ci COMMENT='sequoiadb:{ partition_options: { ShardingKey: {a:1} } }'
 PARTITION BY LIST (`id`)
(PARTITION `p0` VALUES IN (1,3,5) ENGINE = SequoiaDB,
 PARTITION `p1` VALUES IN (2,4,8) ENGINE = SequoiaDB,
 PARTITION `p2` VALUES IN (6,10) ENGINE = SequoiaDB,
 PARTITION `p3` VALUES IN (7,9) ENGINE = SequoiaDB)
DROP TABLE t1;
CREATE TABLE t1 (
age INT,
city VARCHAR(15)
);
SHOW CREATE TABLE t1;
Table	Create Table
t1	CREATE TABLE `t1` (
  `age` int(11) DEFAULT NULL,
  `city` varchar(15) DEFAULT NULL
) ENGINE=SequoiaDB DEFAULT CHARSET=latin1 COLLATE=latin1_swedish_ci
INSERT INTO t1 VALUES(2,'a'),(6,'b'),(7,'c');
SELECT * FROM t1 ORDER BY age;
age	city
ALTER TABLE t1 PARTITION BY LIST ( age ) (
PARTITION p0 VALUES IN (1,3,5),
PARTITION p1 VALUES IN (2,4,8),
PARTITION p2 VALUES IN (6,10),
PARTITION p3 VALUES IN (7,9)
);
SHOW CREATE TABLE t1;
Table	Create Table
t1	CREATE TABLE `t1` (
  `age` int(11) DEFAULT NULL,
  `city` varchar(15) DEFAULT NULL
) ENGINE=SequoiaDB DEFAULT CHARSET=latin1 COLLATE=latin1_swedish_ci
 PARTITION BY LIST (`age`)
(PARTITION `p0` VALUES IN (1,3,5) ENGINE = SequoiaDB,
 PARTITION `p1` VALUES IN (2,4,8) ENGINE = SequoiaDB,
 PARTITION `p2` VALUES IN (6,10) ENGINE = SequoiaDB,
 PARTITION `p3` VALUES IN (7,9) ENGINE = SequoiaDB)
SELECT * FROM t1 ORDER BY age;
age	city
INSERT INTO t1 PARTITION(p0) VALUES(1,'d');
SELECT * FROM t1 PARTITION(p0);
age	city
UPDATE t1 PARTITION(p1) SET city = 'e';
SELECT * FROM t1 PARTITION(p1);
age	city
DELETE FROM t1 PARTITION(p2) WHERE age > 3;
SELECT * FROM t1 PARTITION(p2);
age	city
ALTER TABLE t1 PARTITION BY HASH( age ) PARTITIONS 4;
SHOW CREATE TABLE t1;
Table	Create Table
t1	CREATE TABLE `t1` (
  `age` int(11) DEFAULT NULL,
  `city` varchar(15) DEFAULT NULL
) ENGINE=SequoiaDB DEFAULT CHARSET=latin1 COLLATE=latin1_swedish_ci
 PARTITION BY HASH (`age`)
PARTITIONS 4
SELECT * FROM t1 ORDER BY age;
age	city
INSERT INTO t1 VALUES(200,'w');
SELECT * FROM t1 ORDER BY age;
age	city
UPDATE t1 SET city = 'ccc' WHERE age > 100;
SELECT * FROM t1 ORDER BY age;
age	city
DELETE FROM t1 WHERE age > 60;
SELECT * FROM t1 ORDER BY age;
age	city
ALTER TABLE t1 REMOVE PARTITIONING;
SHOW CREATE TABLE t1;
Table	Create Table
t1	CREATE TABLE `t1` (
  `age` int(11) DEFAULT NULL,
  `city` varchar(15) DEFAULT NULL
) ENGINE=SequoiaDB DEFAULT CHARSET=latin1 COLLATE=latin1_swedish_ci
SELECT * FROM t1 ORDER BY age;
age	city
INSERT INTO t1 VALUES(555,'666');
SELECT * FROM t1 ORDER BY age;
age	city
DROP TABLE t1;
SET sequoiadb_execute_only_in_mysql = OFF;
