drop table if exists t1, t2;
create table t1(a int, b int, c int);
create table t2(a int, b int, c int);
begin;
insert into t1 values(1,1,1),(2,2,2),(3,3,3),(4,4,4),(5,5,5);
insert into t2 values(1,1,1),(2,2,2),(3,3,3),(4,4,4),(5,5,5);
update t1 set a=100 where a>3;
update t2 set a=100 where a>3;
delete from t1 where a=2;
delete from t2 where a=2;
rollback;
Warnings:
Warning	1196	Some non-transactional changed tables couldn't be rolled back
select * from t1 order by a,b,c;
a	b	c
1	1	1
3	3	3
100	4	4
100	5	5
select * from t2 order by a,b,c;
a	b	c
1	1	1
3	3	3
100	4	4
100	5	5
begin;
insert into t1 values(4,4,4),(5,5,5),(6,6,6),(7,7,7),(8,8,8);
insert into t2 values(4,4,4),(5,5,5),(6,6,6),(7,7,7),(8,8,8);
update t1 set a=1000 where a in(6,7,8);
update t1 set a=1000 where a in(6,7,8);
delete from t1 where a=5;
delete from t2 where a=5;
commit;
select * from t1 order by a,b,c;
a	b	c
1	1	1
3	3	3
4	4	4
100	4	4
100	5	5
1000	6	6
1000	7	7
1000	8	8
select * from t2 order by a,b,c;
a	b	c
1	1	1
3	3	3
4	4	4
6	6	6
7	7	7
8	8	8
100	4	4
100	5	5
drop table t1,t2;
CREATE TABLE t1 ( a INT );
CREATE TABLE t2 ( a INT );
CREATE TABLE t3 ( a INT );
INSERT INTO t1 VALUES (1),(-1),(0),(NULL),(10);
INSERT INTO t2 VALUES (1),(-1),(0),(NULL),(10);
INSERT INTO t3 VALUES (1),(-1),(0),(NULL),(10);
SET sql_mode = "STRICT_TRANS_TABLES";
ALTER TABLE t1 change a a INT NOT NULL,algorithm=inplace;
SHOW WARNINGS;
Level	Code	Message
Error	1263	Column set to default value; NULL supplied to NOT NULL column 'a' at row 1
SELECT * FROM t1 ORDER BY a;
a
-1
0
0
1
10
SET sql_mode = "STRICT_ALL_TABLES";
ALTER TABLE t2 change a a INT NOT NULL,algorithm=inplace;
ERROR 22004: Invalid use of NULL value
show create table t2;
Table	Create Table
t2	CREATE TABLE `t2` (
  `a` int(11) DEFAULT NULL
) ENGINE=SequoiaDB DEFAULT CHARSET=latin1 COLLATE=latin1_swedish_ci
SELECT * FROM t2 ORDER BY a;
a
NULL
-1
0
1
10
SET sql_mode = "";
ALTER TABLE t3 change a a INT NOT NULL,algorithm=inplace;
INSERT INTO t3 VALUES (NULL);
ERROR 23000: Column 'a' cannot be null
SELECT * FROM t3 ORDER BY a;
a
-1
0
0
1
10
DROP TABLE t1,t2,t3;
CREATE TABLE t1 ( a VARCHAR(255) );
SET sql_mode = "STRICT_TRANS_TABLES";
ALTER TABLE t1 MODIFY a VARCHAR(100),algorithm=inplace;
ERROR 0A000: ALGORITHM=INPLACE is not supported. Reason: Can't do such type conversion.. Try ALGORITHM=COPY
SET sql_mode = "STRICT_ALL_TABLES";
ALTER TABLE t1 MODIFY a VARCHAR(100),algorithm=inplace;
DROP TABLE t1;
CREATE TABLE t1 ( a INT );
SET sql_mode = "STRICT_TRANS_TABLES";
ALTER TABLE t1 MODIFY a TINYINT,algorithm=inplace;
ERROR 0A000: ALGORITHM=INPLACE is not supported. Reason: Can't do such type conversion.. Try ALGORITHM=COPY
SET sql_mode = "STRICT_ALL_TABLES";
ALTER TABLE t1 MODIFY a TINYINT,algorithm=inplace;
DROP TABLE t1;
set sql_mode = default;
