drop table if exists t1;
SET SQL_SAFE_UPDATES=1,SQL_SELECT_LIMIT=4, MAX_JOIN_SIZE=9;
create table t1 (a int auto_increment primary key, b char(20));
insert into t1 values(1,"test");
SELECT SQL_BUFFER_RESULT * from t1;
a	b
1	test
update t1 set b="a" where a=1;
delete from t1 where a=1;
insert into t1 values(1,"test"),(2,"test2");
SELECT SQL_BUFFER_RESULT * from t1;
a	b
1	test
2	test2
update t1 set b="a" where a=1;
SET SQL_SAFE_UPDATES=1,SQL_SELECT_LIMIT=4, MAX_JOIN_SIZE=20;
select 1 from t1,t1 as t2,t1 as t3;
1
1
1
1
1
update t1 set b="a";
ERROR HY000: You are using safe update mode and you tried to update a table without a WHERE that uses a KEY column. 
update t1 set b="a" where b="test";
ERROR HY000: You are using safe update mode and you tried to update a table without a WHERE that uses a KEY column. 
delete from t1;
ERROR HY000: You are using safe update mode and you tried to update a table without a WHERE that uses a KEY column. 
delete from t1 where b="test";
ERROR HY000: You are using safe update mode and you tried to update a table without a WHERE that uses a KEY column. 
delete from t1 where a+0=1;
ERROR HY000: You are using safe update mode and you tried to update a table without a WHERE that uses a KEY column. 
select 1 from t1,t1 as t2,t1 as t3,t1 as t4,t1 as t5;
ERROR 42000: The SELECT would examine more than MAX_JOIN_SIZE rows; check your WHERE and use SET SQL_BIG_SELECTS=1 or SET MAX_JOIN_SIZE=# if the SELECT is okay
update t1 set b="a" limit 1;
update t1 set b="a" where b="b" limit 2;
delete from t1 where b="test" limit 1;
delete from t1 where a+0=1 limit 2;
alter table t1 add key b (b);
SET MAX_JOIN_SIZE=2;
SELECT @@MAX_JOIN_SIZE, @@SQL_BIG_SELECTS;
@@MAX_JOIN_SIZE	@@SQL_BIG_SELECTS
2	0
insert into t1 values (null,"a"),(null,"a"),(null,"a"),(null,"a"),(null,"a"),(null,"a"),(null,"a"),(null,"a"),(null,"a"),(null,"a");
SELECT * from t1 order by a;
ERROR 42000: The SELECT would examine more than MAX_JOIN_SIZE rows; check your WHERE and use SET SQL_BIG_SELECTS=1 or SET MAX_JOIN_SIZE=# if the SELECT is okay
SET SQL_BIG_SELECTS=1;
SELECT * from t1 order by a;
a	b
2	test2
3	a
4	a
5	a
SET MAX_JOIN_SIZE=2;
SELECT * from t1;
ERROR 42000: The SELECT would examine more than MAX_JOIN_SIZE rows; check your WHERE and use SET SQL_BIG_SELECTS=1 or SET MAX_JOIN_SIZE=# if the SELECT is okay
SET MAX_JOIN_SIZE=DEFAULT;
SELECT * from t1;
a	b
2	test2
3	a
4	a
5	a
drop table t1;
create table t1 (a int);
insert into t1 values (1),(2),(3),(4),(5);
insert into t1 select * from t1;
insert into t1 select * from t1;
insert into t1 select * from t1;
set local  max_join_size=8;
select * from (select * from t1) x;
ERROR 42000: The SELECT would examine more than MAX_JOIN_SIZE rows; check your WHERE and use SET SQL_BIG_SELECTS=1 or SET MAX_JOIN_SIZE=# if the SELECT is okay
set local  max_join_size=1;
select * from (select a.a as aa, b.a as ba from t1 a, t1 b) x;
ERROR 42000: The SELECT would examine more than MAX_JOIN_SIZE rows; check your WHERE and use SET SQL_BIG_SELECTS=1 or SET MAX_JOIN_SIZE=# if the SELECT is okay
set local  max_join_size=1;
select * from (select 1 union select 2 union select 3) x;
ERROR 42000: The SELECT would examine more than MAX_JOIN_SIZE rows; check your WHERE and use SET SQL_BIG_SELECTS=1 or SET MAX_JOIN_SIZE=# if the SELECT is okay
drop table t1;
SET SQL_SAFE_UPDATES=0,SQL_SELECT_LIMIT=DEFAULT, MAX_JOIN_SIZE=DEFAULT;
#
# Bug #28145710: SQL_SAFE_UPDATES ERROR IS INSUFFICIENTLY INFORMATIVE
#
CREATE TABLE t1 (c1 INT NOT NULL, c2 VARCHAR(200) NOT NULL,
UNIQUE KEY idx1 (c1), UNIQUE KEY idx2 (c2));
CREATE TABLE t2 (c1 INT NOT NULL, c2 VARCHAR(200) NOT NULL,
UNIQUE KEY idx1 (c1));
INSERT INTO t1 VALUES (1, 'a'), (2, 'b'), (3, 'c'), (4, 'd');
INSERT INTO t2 VALUES (11, 'a'), (12, 'b'), (3, 'c'), (14, 'd');
ANALYZE TABLE t1, t2;
Table	Op	Msg_type	Msg_text
x	analyze	status	OK
x	analyze	status	OK
SET SESSION sql_safe_updates=1;
SET RANGE_OPTIMIZER_MAX_MEM_SIZE= 1;
DELETE FROM t1 WHERE c1 IN (1,22);
ERROR HY000: You are using safe update mode and you tried to update a table without a WHERE that uses a KEY column. Memory capacity of 1 bytes for 'range_optimizer_max_mem_size' exceeded. Range optimization was not done for this query.
UPDATE t1 SET c1=20 WHERE c1 IN (1,22);
ERROR HY000: You are using safe update mode and you tried to update a table without a WHERE that uses a KEY column. Memory capacity of 1 bytes for 'range_optimizer_max_mem_size' exceeded. Range optimization was not done for this query.
SET RANGE_OPTIMIZER_MAX_MEM_SIZE= default;
DELETE t1 FROM t1 JOIN t2 ON t1.c2 = t2.c1;
ERROR HY000: You are using safe update mode and you tried to update a table without a WHERE that uses a KEY column. Cannot use ref access on index 'idx2' due to type or collation conversion on field 'c2'
UPDATE t1, t2 SET t1.c1=20 WHERE t1.c2 = t2.c1;
ERROR HY000: You are using safe update mode and you tried to update a table without a WHERE that uses a KEY column. Cannot use ref access on index 'idx2' due to type or collation conversion on field 'c2'
DELETE t2 FROM t1 JOIN t2 ON t1.c2 = t2.c1;
Warnings:
Warning	1739	Cannot use ref access on index 'idx2' due to type or collation conversion on field 'c2'
DELETE FROM t1 WHERE c2 IN(1,2222);
ERROR HY000: You are using safe update mode and you tried to update a table without a WHERE that uses a KEY column. Cannot use range access on index 'idx2' due to type or collation conversion on field 'c2'
UPDATE t1 SET c1=20 WHERE c2 IN(1,2222);
ERROR HY000: You are using safe update mode and you tried to update a table without a WHERE that uses a KEY column. Cannot use range access on index 'idx2' due to type or collation conversion on field 'c2'
DELETE FROM t2 WHERE c2 IN('a','e');
ERROR HY000: You are using safe update mode and you tried to update a table without a WHERE that uses a KEY column. 
DELETE FROM t2;
ERROR HY000: You are using safe update mode and you tried to update a table without a WHERE that uses a KEY column. 
SET sql_log_bin= 0;
DELETE FROM t2;
ERROR HY000: You are using safe update mode and you tried to update a table without a WHERE that uses a KEY column. 
SET sql_log_bin= default;
DROP TABLE t1, t2;
SET SESSION sql_safe_updates=default;
