drop database if exists metadata_sync_table_ddl_dml_parallel;
create database metadata_sync_table_ddl_dml_parallel;
use metadata_sync_table_ddl_dml_parallel;
create table t1(a int);
use metadata_sync_table_ddl_dml_parallel;
insert into t1 values(1),(2),(3);
select * from t1 order by a;
a
1
2
3
alter table t1 add column col1 int;
insert into t1 values(4,4),(5,5),(6,6);
select * from t1 order by a;
a	col1
1	NULL
2	NULL
3	NULL
4	4
5	5
6	6
alter table t1 change col1 col2 int;
insert into t1(a, col1) values(10,10),(11,11),(12,12);
ERROR 42S22: Unknown column 'col1' in 'field list'
insert into t1(a, col2) values(7,7),(8,8),(9,9);
select * from t1 order by a;
a	col2
1	NULL
2	NULL
3	NULL
4	4
5	5
6	6
7	7
8	8
9	9
alter table t1 drop column col2;
insert into t1(a, col2) values(10,10),(11,11),(12,12);
ERROR 42S22: Unknown column 'col2' in 'field list'
insert into t1 values(10),(11),(12);
select * from t1 order by a;
a
1
2
3
4
5
6
7
8
9
10
11
12
drop table t1;
insert into t1 values(10),(11),(12);
ERROR 42S02: Table 'metadata_sync_table_ddl_dml_parallel.t1' doesn't exist
create table t1(a int);
drop table t1;
create table t1(a int);
drop table t1;
create table t1(a int);
drop table t1;
create table t1(a int);
insert into t1 values(1),(2),(3);
select * from t1 order by a;
a
1
2
3
alter table t1 add column col1 int;
alter table t1 drop column col1;
alter table t1 add column col1 int;
alter table t1 drop column col1;
alter table t1 add column col1 int;
alter table t1 drop column col1;
alter table t1 add column col1 int;
insert into t1(a, col1) values(4,4),(5,5),(6,6);
select * from t1 order by a;
a	col1
1	NULL
2	NULL
3	NULL
4	4
5	5
6	6
alter table t1 change col1 col2 int;
alter table t1 change col2 col1 int;
alter table t1 change col1 col2 int;
alter table t1 change col2 col1 int;
alter table t1 change col1 col2 int;
alter table t1 change col2 col1 int;
insert into t1(a, col1) values(4,4),(5,5),(6,6);
select * from t1 order by a;
a	col1
1	NULL
2	NULL
3	NULL
4	4
4	4
5	5
5	5
6	6
6	6
drop table t1;
create table t1(a int auto_increment key)COMMENT='sequoiadb:{auto_partition:false}';
insert into t1 values(),(),();
select * from t1 order by a;
a
1
2
3
alter table t1 auto_increment = 2002;
insert into t1 values(),(),();
select * from t1 order by a;
a
1
2
3
2005
2006
2007
alter table t1 change a col1 int auto_increment;
insert into t1 values(),(),();
alter table t1 modify col1 int;
insert into t1 values(),(),();
ERROR HY000: Field 'col1' doesn't have a default value
alter table t1 drop primary key;
alter table t1 add col2 int auto_increment key;
insert into t1(col1) values(4),(5),(6);
drop table t1;
create table t1(a int unique key);
select * from t1 force index(a);
a
alter table t1 drop index a;
select * from t1 force index(a);
ERROR 42000: Key 'a' doesn't exist in table 't1'
alter table t1 add unique key a(a);
select * from t1 force index(a);
a
drop table t1;
create table t1(a int);
alter table t1 rename t2;
insert into t2 values();
insert into t1 values();
ERROR 42S02: Table 'metadata_sync_table_ddl_dml_parallel.t1' doesn't exist
rename table t2 to t1,t1 to t2, t2 to t1;
insert into t1 values();
insert into t2 values();
ERROR 42S02: Table 'metadata_sync_table_ddl_dml_parallel.t2' doesn't exist
select * from t1 order by a;
a
NULL
NULL
drop table t1;
create table t1(col1 int default 10);
insert into t1 values();
select * from t1 order by col1;
col1
10
alter table t1 modify col1 int default 20;
insert into t1 values();
select * from t1 order by col1;
col1
10
20
alter table t1 modify col1 int;
insert into t1 values();
select * from t1 order by col1;
col1
NULL
10
20
alter table t1 modify col1 tinyint;
insert into t1 values(128);
ERROR 22003: Out of range value for column 'col1' at row 1
select * from t1 order by col1;
col1
NULL
10
20
alter table t1 modify col1 bigint;
insert into t1 values(2147483648);
select * from t1 order by col1;
col1
NULL
10
20
2147483648
drop table t1;
create table t1(col1 int);
insert into t1 values(1),(2),(3);
alter table t1 engine = innodb;
insert into t1 values(4),(5),(6);
select * from t1 order by col1;
col1
4
5
6
alter table t1 engine = sequoiadb;
insert into t1 values(7),(8),(9);
select * from t1 order by col1;
col1
4
5
6
7
8
9
drop table t1;
create table t1 (a int, b int, c int generated always as (a + 1) virtual, d int  generated always as (b + 2) stored );
insert into t1(a,b) values(1,1);
select * from t1 order by a;
a	b	c	d
1	1	2	3
alter table t1 modify c int generated always as (a + 10) virtual, modify d int generated always as (b + 20) stored;
insert into t1(a,b) values(2,2);
select * from t1 order by a;
a	b	c	d
1	1	11	21
2	2	12	22
alter table t1 drop column c,drop column d;
insert into t1(a,b) values(3,3);
select * from t1 order by a;
a	b
1	1
2	2
3	3
alter table t1 add column c int generated always as (a + 1) virtual, add column d int  generated always as (b + 2) stored;
insert into t1(a,b) values(4,4);
select * from t1 order by a;
a	b	c	d
1	1	2	3
2	2	3	4
3	3	4	5
4	4	5	6
alter table t1 drop column c,drop column d;
insert into t1(a,b) values(5,5);
select * from t1 order by a;
a	b
1	1
2	2
3	3
4	4
5	5
drop table t1;
create table t1(a int);
create table t2(a int);
create table t3(a int);
create table t4(a int);
insert into t1 values(1);
insert into t2 values(1);
insert into t3 values(1);
insert into t4 values(1);
drop table t1,t2,t3,t4;
insert into t4 values(2);
ERROR 42S02: Table 'metadata_sync_table_ddl_dml_parallel.t4' doesn't exist
insert into t3 values(2);
ERROR 42S02: Table 'metadata_sync_table_ddl_dml_parallel.t3' doesn't exist
insert into t2 values(2);
ERROR 42S02: Table 'metadata_sync_table_ddl_dml_parallel.t2' doesn't exist
insert into t1 values(2);
ERROR 42S02: Table 'metadata_sync_table_ddl_dml_parallel.t1' doesn't exist
create table t1(a int);
insert into t1 values(1),(2),(3),(4);
truncate t1;
insert into t1 values(1),(2),(3),(4);
select * from t1 order by a;
a
1
2
3
4
drop table t1;
create table t1(a int);
insert into t1 values(1);
alter table t1 add unique index a(a);
insert into t1 values(1);
ERROR 23000: Duplicate entry '{ "a": 1 }' for key 'a'
select * from t1 order by a;
a
1
alter table t1 drop index a;
insert into t1 values(1);
select * from t1 order by a;
a
1
1
delete from t1;
insert into t1 values(1);
alter table t1 add unique index a(a);
insert into t1 values (1) on duplicate key update a = a+1;
select * from t1 order by a;
a
2
drop table t1;
create table t2(a int key);
insert into t2 values(1),(2),(3),(4);
create table t1 like t2;
insert into t2 values(5),(6),(7),(8);
insert into t1 values(5),(6),(7),(8);
select * from t2 order by a;
a
1
2
3
4
5
6
7
8
select * from t1 order by a;
a
5
6
7
8
drop table t2;
insert into t1 values(9),(10),(11),(12);
select * from t1 order by a;
a
5
6
7
8
9
10
11
12
drop table t1;
create table t2(a int key);
insert into t2 values(1),(2),(3),(4);
create table t1 as select * from t2;
insert into t2 values(5),(6),(7),(8);
insert into t1 values(5),(6),(7),(8);
select * from t2 order by a;
a
1
2
3
4
5
6
7
8
select * from t1 order by a;
a
1
2
3
4
5
6
7
8
drop table t2;
insert into t1 values(9),(10),(11),(12);
select * from t1 order by a;
a
1
2
3
4
5
6
7
8
9
10
11
12
drop table t1;
create table t2(a int);
insert into t2 values(1),(2),(3),(4);
create table t1 like t2;
insert into t1 select * from t2;
select * from t1 order by a;
a
1
2
3
4
create table t3 like t2;
drop table t2;
insert into t3 select * from t2;
ERROR 42S02: Table 'metadata_sync_table_ddl_dml_parallel.t2' doesn't exist
drop table t1,t3;
create table t1(a int);
insert into t1 values(1),(2),(3),(4);
update t1 set a = a + 1;
select * from t1 order by a;
a
2
3
4
5
alter table t1 add unique key a(a);
select * from t1 order by a;
a
2
3
4
5
update t1 set a =100;
ERROR 23000: Duplicate entry '{ "a": 100 }' for key 'a'
select * from t1 order by a;
a
2
3
4
5
alter table t1 drop index a;
update t1 set a =100;
select * from t1 order by a;
a
100
100
100
100
alter table t1 add col1 int default 10;
update t1 set a = a + 1 where col1 = 10;
select * from t1 order by a;
a	col1
101	10
101	10
101	10
101	10
alter table t1 modify a tinyint;
update t1 set a =100 + a;
ERROR 22003: Out of range value for column 'a' at row 1
alter table t1 modify a bigint;
update t1 set a =100 + a;
select * from t1 order by a;
a	col1
201	10
201	10
201	10
201	10
alter table t1 change a col2 int;
update t1 set a =1 + a;
ERROR 42S22: Unknown column 'a' in 'field list'
update t1 set col2 =1 + col2;
select * from t1 order by col2;
col2	col1
202	10
202	10
202	10
202	10
alter table t1 rename to t2;
update t2 set col2 = 1 + col2;
select * from t2 order by col2;
col2	col1
203	10
203	10
203	10
203	10
alter table t2 engine=innodb;
update t2 set col2 = 1 + col2;
select * from t2 order by col2;
col2	col1
set server_ha_wait_sync_timeout = 10;
drop table t2;
set server_ha_wait_sync_timeout = 0;
update t2 set col2 = 1 + col2;
ERROR 42S02: Table 'metadata_sync_table_ddl_dml_parallel.t2' doesn't exist
create table t1(a int);
insert into t1 values(1),(2),(3),(4);
delete from t1;
select * from t1 order by a;
a
insert into t1 values(1),(2),(3),(4);
alter table t1 add col1 int default 10;
delete from t1 where col1 = 10;
select * from t1 order by a;
a	col1
insert into t1 values(1,1),(2,2),(3,3),(4,4);
set server_ha_wait_sync_timeout = 10;
alter table t1 drop column col1;
set server_ha_wait_sync_timeout = 0;
delete from t1 where col1=1;
ERROR 42S22: Unknown column 'col1' in 'where clause'
select * from t1 order by a;
a
1
2
3
4
alter table t1 change a col2 int;
delete from t1 where col2=4;
select * from t1 order by col2;
col2
1
2
3
alter table t1 rename to t2;
delete from t2;
select * from t2 order by col2;
col2
alter table t2 engine=innodb;
delete from t2;
set server_ha_wait_sync_timeout = 10;
drop table t2;
set server_ha_wait_sync_timeout = 0;
delete from t2;
ERROR 42S02: Table 'metadata_sync_table_ddl_dml_parallel.t2' doesn't exist
create table t1(a int, b int);
insert into t1 values(1,1),(2,2),(3,3);
create table t2(a int, b int);
insert into t2 values(1,1),(4,4),(5,5);
select * from t1,t2 where t1.a = t2.a;
a	b	a	b
1	1	1	1
alter table t1 change a col1 int;
update t1,t2 set t1.col1=t1.col1+1 where t1.col1 = t2.a;
select * from t1 order by col1;
col1	b
2	1
2	2
3	3
alter table t2 change a col1 int;
delete t1 from t1,t2 where t1.col1 > t2.col1;
select * from t1 order by col1;
col1	b
set server_ha_wait_sync_timeout = 10;
drop table t2;
set server_ha_wait_sync_timeout = 0;
delete t1 from t1,t2 where t1.col1 > t2.col1;
ERROR 42S02: Table 'metadata_sync_table_ddl_dml_parallel.t2' doesn't exist
set server_ha_wait_sync_timeout = 10;
create table t2(a int);
drop table t1;
set server_ha_wait_sync_timeout = 0;
select * from t1,t2 where t1.a = t2.a;
ERROR 42S02: Table 'metadata_sync_table_ddl_dml_parallel.t1' doesn't exist
drop table t2;
create table t1(a int primary key, b int);
insert into t1 values(1,1),(2,2),(3,3),(4,4);
replace into t1 values(1,10),(2,20),(3,30);
select * from t1 order by a;
a	b
1	10
2	20
3	30
4	4
alter table t1 add col1 int default 10;
replace into t1 values(1,100,100),(2,200,200),(3,300,300);
select * from t1 order by a;
a	b	col1
1	100	100
2	200	200
3	300	300
4	4	10
alter table t1 drop column col1;
replace into t1 values(1,1000),(2,2000),(3,3000);
select * from t1 order by a;
a	b
1	1000
2	2000
3	3000
4	4
drop table t1;
replace into t1 values(1,1000),(2,2000),(3,3000);
ERROR 42S02: Table 'metadata_sync_table_ddl_dml_parallel.t1' doesn't exist
create table t2(a int primary key, b int);
insert into t2 values(1,1),(2,2),(3,3),(4,4);
create table t1 like t2;
replace into t1 select * from t2;
select * from t1 order by a;
a	b
1	1
2	2
3	3
4	4
drop table t2;
replace into t1 select * from t2;
ERROR 42S02: Table 'metadata_sync_table_ddl_dml_parallel.t2' doesn't exist
drop table t1;
set server_ha_wait_sync_timeout = 10;
create table t1 ( x INT, y INT );
set server_ha_wait_sync_timeout = 0;
insert into t1 values (1,1);
select * from metadata_sync_table_ddl_dml_parallel.t1;
x	y
1	1
use metadata_sync_table_ddl_dml_parallel;
show create table t1;
Table	Create Table
t1	CREATE TABLE `t1` (
  `x` int(11) DEFAULT NULL,
  `y` int(11) DEFAULT NULL
) ENGINE=SequoiaDB DEFAULT CHARSET=utf8mb4 COLLATE=utf8mb4_bin
set server_ha_wait_sync_timeout = 10;
alter table t1 drop column x, add column z int default 1;
set server_ha_wait_sync_timeout = 0;
select * from t1;
y	z
1	1
drop table t1;
create table t1(a int);
select * from t1;
a
alter table t1 add column col1 int;
select col1 from t1;
col1
alter table t1 change col1 col2 int;
select col2 from t1;
col2
alter table t1 drop column col2;
select col2 from t1;
ERROR 42S22: Unknown column 'col2' in 'field list'
alter table t1 add index a(a);
select * from t1 force index(a);
a
alter table t1 drop index a;
select * from t1 force index(a);
ERROR 42000: Key 'a' doesn't exist in table 't1'
rename table t1 to t2;
select * from t2;
a
alter table t2 engine=innodb;
select * from t2;
a
drop table t2;
create table t1(a int auto_increment primary key,b int ,c int);
insert into t1(b,c) values(1,1),(2,2),(3,3);
create view v1 as select * from t1;
select * from v1 order by a;
a	b	c
1	1	1
2	2	2
3	3	3
alter table t1 drop column b;
select * from v1 order by a;
ERROR HY000: View 'metadata_sync_table_ddl_dml_parallel.v1' references invalid table(s) or column(s) or function(s) or definer/invoker of view lack rights to use them
alter table t1 add column b int;
select * from v1 order by a;
a	b	c
1	NULL	1
2	NULL	2
3	NULL	3
drop table t1;
select * from v1 order by a;
ERROR HY000: View 'metadata_sync_table_ddl_dml_parallel.v1' references invalid table(s) or column(s) or function(s) or definer/invoker of view lack rights to use them
create table t1(a int auto_increment primary key,b int ,c int);
insert into t1(b,c) values(1,1),(2,2),(3,3);
select * from v1 order by a;
a	b	c
1	1	1
2	2	2
3	3	3
create or replace view v1 as select * from t1 where a<2;
select * from v1 order by a;
a	b	c
1	1	1
drop database if exists table_ddl_dml_parallel_user;
create user 'table_ddl_dml_parallel_user';
GRANT SELECT ON metadata_sync_table_ddl_dml_parallel.* TO table_ddl_dml_parallel_user@'%' IDENTIFIED BY 'table_ddl_dml_parallel_user' WITH GRANT OPTION;
Warnings:
Warning	1287	Using GRANT statement to modify existing user's properties other than privileges is deprecated and will be removed in future release. Use ALTER USER statement for this operation.
FLUSH PRIVILEGES;
alter definer=table_ddl_dml_parallel_user view v1 as select * from t1;
use metadata_sync_table_ddl_dml_parallel;
select * from v1 order by a;
a	b	c
1	1	1
2	2	2
3	3	3
drop view v1;
show create view v1;
ERROR 42S02: Table 'metadata_sync_table_ddl_dml_parallel.v1' doesn't exist
drop table t1;
drop user table_ddl_dml_parallel_user;
FLUSH PRIVILEGES;
create table t1(a int);
set server_ha_wait_sync_timeout = 10;
alter table t1 add index a(a);
set server_ha_wait_sync_timeout = 0;
explain select * from t1 force index(a);
id	select_type	table	partitions	type	possible_keys	key	key_len	ref	rows	filtered	Extra
1	SIMPLE	t1	NULL	index	NULL	a	5	NULL	0	0.00	Using index
Warnings:
Note	1003	/* select#1 */ select `metadata_sync_table_ddl_dml_parallel`.`t1`.`a` AS `a` from `metadata_sync_table_ddl_dml_parallel`.`t1` FORCE INDEX (`a`)
set server_ha_wait_sync_timeout = 10;
drop index a on t1;
set server_ha_wait_sync_timeout = 0;
explain select * from t1 force index(a);
ERROR 42000: Key 'a' doesn't exist in table 't1'
drop table t1;
create table t1(a int key);
analyze table t1;
Table	Op	Msg_type	Msg_text
metadata_sync_table_ddl_dml_parallel.t1	analyze	status	OK
drop table t1;
analyze table t1;
Table	Op	Msg_type	Msg_text
metadata_sync_table_ddl_dml_parallel.t1	analyze	Error	Table 'metadata_sync_table_ddl_dml_parallel.t1' doesn't exist
metadata_sync_table_ddl_dml_parallel.t1	analyze	status	Operation failed
create table t1(a int key);
desc t1;
Field	Type	Null	Key	Default	Extra
a	int(11)	NO	PRI	NULL	
drop table t1;
desc t1;
ERROR 42S02: Table 'metadata_sync_table_ddl_dml_parallel.t1' doesn't exist
drop database metadata_sync_table_ddl_dml_parallel;
